b_with_b_id,recipe_name,recipe_link,recipe_thumbnail,date_published,recipe_description,recipe_ingredients,recipe_directions,external_url
100034,Egg Sandwich (with Homemade Ciabatta) inspired by Birds of Prey,https://www.bingingwithbabish.com/recipes/bop-egg-sandwich,https://images.squarespace-cdn.com/content/v1/590be7fd15d5dbc6bf3e22d0/1582671280856-BG2PFY78C22W7UPV43LW/ke17ZwdGBToddI8pDm48kGh9ZJ2O0qy0uKSL-_2aFaR7gQa3H78H3Y0txjaiv_0fDoOvxcdMmMKkDsyUqMSsMWxHk725yiiHCCLfrh8O1z4YTzHvnKhyp6Da-NYroOW3ZGjoBKy3azqku80C789l0tVKkOu97tLoEUCMOIXiAV46WLB4Mpo4oPXEhDdhWMhycxyyYCssjrvYNcG08yYyYQ/image+%286%29.png?format=500w,2020-02-25,"[""Margot Robbie continues her streak as Americaustralia's national treasure in her second turn as the delightfully unhinged Harley Quinn in Birds of Prey, a movie I have admittedly not yet seen.  From what I hear though, she sheds bitter tears as her lover falls to the pavement in a fateful chase through the Gotham City streets.  No, I'm not talking about the the tatted-up, purring, emo-glam Joker - I'm talking about the perfect egg sandwich.""]","['INGREDIENTS', 'Homemade Ciabatta', 'Pre-Ferment:', '177 grams all-purpose flour', '1/16th tsp instant yeast', '177 grams water', 'Main Dough:', '361 grams all-purpose flour', '1 packet (7 grams) instant yeast', '2 tsp (12 grams) kosher salt', '2 Tbsp (14 grams) instant non-fat milk', '152 grams water', '3 Tbsp (35 grams) olive oil', 'Sandwich Fillings:', '4 slices bacon', '½ cup water', '2 duck (or chicken) eggs', '2 slices American cheese', 'Hot sauce']","['Method', 'Homemade Ciabatta', 'Start by making a pre-ferment with 177 grams of all-purpose flour, 1/16th tsp of instant yeast and 177 grams of room temperature water. Mix together until it resembles a too-thick pancake batter. Wrap tight in plastic wrap and let sit at room temperature for 8 hours, then refrigerate overnight. ', 'For the main dough, add the following to the bowl of your stand mixer: 361 grams of all-purpose flour, 1 packet (7 grams) of instant yeast, 2 tsp (12 grams) of kosher salt, 2 Tbsp (14 grams) of instant non-fat milk, the entirety of the pre-ferment, 152 grams of lukewarm water, and 3 Tbsp (35 grams) of olive oil. ', 'Mix together using the paddle attachment. Once it all comes together, remove the paddle and replace with a dough hook and knead on medium-low speed for 7-8 minutes until smooth, shiny, and sticky. ', 'Use the dough stickiness to roll into a taught ball. Place it into a well-oiled bowl and cover tightly with plastic wrap. Let rest at room temperature for 2-3 hours, or more than doubled in size.', 'Using an oiled rubber spatula, fold the dough in and on itself, turning the bowl as you go, 8 times. Cover and let rest for 30 minutes and then repeat the process one time. ', 'After another 30 minutes, spread the dough into a large rectangle on a well-floured work surface. Pop any huge bubbles that appear, and then trim the dough into your desired size ciabatta pieces - I recommend 4x6 inches or 4x8 inches. ', 'Set the pieces of dough on a heavily floured piece of parchment paper set in a rimmed baking sheet. Cover with an inverted rimmed baking sheet. Let proof and rest at room temperature for 1 hour. ', 'Cut the parchment in half (so you have half the dough on one side), spritz dough pieces generously with water, and sprinkle with a little more flour. Use a pizza peel to place the dough on a preheated pizza stone in a 450°F oven. Bake for 18-20 minutes, until browned and puffed.', 'Brush off the excess flour and let cool for at least one hour. ', 'Use a shallow rimmed baking sheet as a cutting template to cut the bread in half with a bread knife. Proceed to sandwich assembly!', 'Sandwich Assembly', 'On the stove top, place 4 slices of bacon in a heavy cast iron pan topping with ½ cup of water and over medium heat. Once the water has evaporated and the bacon starts to brown, give it a flip and cook to your desired crispiness. ', 'Toast the ciabatta buns in the cast iron pan using the leftover bacon grease. Remove buns from pan and top with bacon.', 'To cook the eggs, pour a little extra bacon grease into a cast iron skillet, then crack two duck (or chicken) eggs into the pan. Fry sunny side up until the sides are brown and toasty. Add 2 slices of American cheese to the top. Cover the pan with a lid until the cheese melts, the whites set, and the yolk is still runny. ', 'Hit the cheese with a few glugs of hot sauce and the place the egg-cheese-hot sauce combo on the ciabatta bread on top of the bacon. ']",https://www.bingingwithbabish.com/
100035,Ram-don inspired by Parasite,https://www.bingingwithbabish.com/recipes/ram-don-parasite,https://images.squarespace-cdn.com/content/v1/590be7fd15d5dbc6bf3e22d0/1582231606488-R1N60XGQWVTNGKD5BSO1/ke17ZwdGBToddI8pDm48kIt4sjjsJou2GjInMlJIhlR7gQa3H78H3Y0txjaiv_0fDoOvxcdMmMKkDsyUqMSsMWxHk725yiiHCCLfrh8O1z4YTzHvnKhyp6Da-NYroOW3ZGjoBKy3azqku80C789l0vxgGVdDnL6CCr5FK_ApnxWVFFcmHtSzhfSGu0LxuW6Rsr_7xnuZTWl8VctZwoBSoQ/image+%285%29.png?format=500w,2020-02-20,"[""Rarely does a dish serve as such a central metaphor for a film's primary conflict: in Parasite, boujee beef sits oppressively atop bargain noodles in the Park family's version of Ram-Don, the way they sit so literally atop others. It was tricky doing this one without spoilers, but I think I managed!""]","['INGREDIENTS', 'Quick Instant Pack Method:', '1 packet of Neoguri (store bought)', '1 packet of Chapagetti (store bought) ', '1 piece of Korean Hunu Sirloin (Japanese Kobe is a good substitute, or any fancy steak you’re feeling)', 'Ramen Noodles:', '1 cup plus 2 Tbsp baking soda', '½ cup warm water', '8 ½ oz bread flour (about 2 cups)', '1 oz vital wheat gluten (about ¼ cup)', 'Udon Noodles:', '250 grams all-purpose flour', '250 grams bread flour', '250 grams water', '½ tsp kosher salt', 'Korean Dashi:', '8 cups water', '6 medium pieces kelp', 'Dried anchovies', 'Jajangmyeon:', '2 Tbsp Olive Oil ', '⅓ cup sweet black bean paste', '1 Tbsp Oyster Sauce', '2 Tbsp Vegetable Oil ', '6 oz diced pork loin ', '½ yellow onion, chopped', '½ zucchini, chopped', '4oz shredded cabbage', '1-2 inches fresh ginger, grated', '1 Tbsp mirin ', '1 cup dashi broth (you can use chicken broth or water too)', '¼ cup water', '1 Tbsp cornstarch', 'Jjamppong:', '2 Tbsp vegetable oil', '3 Tbsp Korean chili flakes (Gochugaru)', '4 scallions', 'Fresh ginger', '2 cloves garlic', '½ yellow onion, chopped', '½ zucchini, thinly sliced', '4 oz shredded cabbage', '4 shiitake mushrooms, sliced', 'Seafood of choice (I used shrimp and mussels)', 'Kosher salt', 'Freshly ground black pepper']","['Method', 'Quick Instant Pack Method', 'Trim off some of the excess fat from the steak of your choice and cube it into bite-sized pieces. Sear the cubes in a saucepan with hot oil.', 'In some shallow boiling water, place both sets of packaged noodles along with the spicy broth packets and frozen vegetable packets. ', 'After about 4 minutes, both the noodles and beef should be finished cooking. Drain all but ⅓  cup of the cooking broth and add the chapagetti’s packet of vegetable oil and bean sauce. Mix to combine, it will turn a muddy brown color. ', 'Add the beef to the noodles and stir. Serve and enjoy! ', 'Ramen Noodles', 'Start by baking baking soda in a 250℉ oven for 1 hour. Combine 2 tsp of the baked baking soda with 4 ounces plus 1 Tbsp of water. Stir to dissolve completely. ', 'In a mixing bowl, add 240g all-purpose flour along with the alkaline water mixture you just created. Stir to combine with a large wooden spoon. You want to make a shaggy but cohesive ball of dough. If needed, add a little extra water. ', 'Once it’s combined, pat it into a disc, dust it with bread flour, put into a bowl and cover. Let it rest for 30 minutes. ', 'Once it has rested for 30 minutes, remove from bowl and lightly dust it with flour. Roll the dough out and then fold into thirds, and then into thirds again. Roll out just a little bit and then wrap in plastic wrap and let rest for another 30 minutes. ', 'Attach your pasta attachment to your stand mixer. Remove dough from plastic wrap and dust with bread flour. Give it one pass through on your pasta roller’s widest setting. Fold into thirds, rotate 90° and pass it through again on your pasta press at about 2 or 3. If it seems too long, give it a chop in half. ', 'Dust with bread flour again, before passing through your noodle cutter attachment. Add some more bread flour and twist into little nests on a rimmed baking sheet that’s also been dusted with bread flour. ', 'Udon Noodles', 'Start by weighing out 250 grams each of all-purpose flour and bread flour. Add 1 ½ tsp kosher salt to 250 milligrams water. Stir and add to the flour. This gives the dough a hydration of 50%. ', 'Mix that around with your fingers until a shaggy ball of dough forms. Turn it out on an unfloured countertop and knead it until semi-smooth but a little lumpy. ', 'Place into a heavy duty ziploc bag and squeeze out all of the air before sealing shut. Optionally, you can knead the dough on top of a table with your feet. You can also simply knead with your hands until the dough is flattened into a large disc. Fold into fours, place back into the bag and flatten again. Repeat this 5x. Let rest at room temperature for 1-3 hours. ', 'Generously flour the dough and countertop and roll it out using a rolling pin until the dough has reached a thickness of about 3mm.', 'For slicing, place the dough on top of itself like an accordion. Make sure not to press down on the folds and that the folds don’t overlap. With a very sharp knife, cut into thin udon noodle sizes.', 'Once cut, unfurl the noodles and dust them with a generous amount of flour (cornstarch or potato starch) and twist them into nests.', 'Korean Dashi', 'In a large pot, pour in 8 cups of water. Add 6 medium pieces of dried kelp and let them soak for 1 hour. Afterwards, add a handful of dried anchovies.', 'Bring to a roaring simmer and hold it there for about 10 minutes before draining and setting aside.  ', 'Jjangmyeon', 'In a small saute pan, add 2 Tbsp olive oil, ⅓ cup sweet black bean paste, and 1 Tbsp oyster sauce. Fry together for about 2 minutes and set aside.', 'In a large, high-walled saute pan, heat 2 Tbsp of vegetable oil over medium-high heat until almost smoking. Add 6 ounces of diced pork loin and saute for 2-3 minutes. Add chopped zucchini, chopped yellow onion, and shredded cabbage. ', 'Saute together for 2-3 minutes, or until the cabbage is just starting to wilt. Grate in about an inch’s worth of fresh ginger. Add 1 Tbsp mirin and saute for 30 seconds. Add the black bean mixture that you fried earlier. Mix that in until everything is evenly coated, then add in 1 cup of Dashi broth (chicken broth or water work too).', 'Let that mixture gently simmer for 2-3 minutes then thicken everything by adding ¼ cup of water and 1 Tbsp of cornstarch. Mix together, give it a taste, and season to your taste preference with kosher salt. Cover to keep warm. ', 'Boil ramen noodles for no more than 3 minutes, checking for doneness after 90 seconds. Put noodles into a bowl and top with jajangmyeon.', 'Jjamppong', 'Heat 2 Tbsp vegetable oil in a large pot over medium heat. Add 3 Tbsp Korean chili flakes, thinly sliced white bottoms of 4 scallions, an inch of grated ginger, and 2 cloves of grated garlic. ', 'Saute this together for 2-3 minutes and then add chopped yellow onion, sliced zucchini, 4 ounces of shredded cabbage, and 4 thinly sliced shiitake mushrooms. At this time, add the Udon noodles to boiling water since they take 12 minutes to cook.', 'Saute for 2-3 more minutes until everything begins to turn soft. Add 4 cups of dashi broth. Cover and bring to a simmer before adding your seafood of choice. Cover and let simmer. Season with salt and pepper to taste.', 'Take udon noodles out of boiling water when they’re finished and rinse under cold water. Place noodles in a bowl and top with jjamppong.']",https://www.bingingwithbabish.com/
100036,The Perfect Bite (and Duck Carbonara) inspired by YOU,https://www.bingingwithbabish.com/recipes/the-perfect-bite,https://images.squarespace-cdn.com/content/v1/590be7fd15d5dbc6bf3e22d0/1581525739281-R8REQT5KULFVP8SOQ99V/ke17ZwdGBToddI8pDm48kER99XzJSCVY9jo2M337vs17gQa3H78H3Y0txjaiv_0fDoOvxcdMmMKkDsyUqMSsMWxHk725yiiHCCLfrh8O1z4YTzHvnKhyp6Da-NYroOW3ZGjoBKy3azqku80C789l0mKsjHBOd62cZInIsOsdpMPEkjpxUmuDQrgYGd_3JVD-asZUz1AxDR3_cGGQ8tD2cA/Screen+Shot+2020-02-11+at+4.17.19+PM.png?format=500w,2020-02-12,"['Do yourself a favor: don\'t start ""You"" if you don\'t have a full day in which to binge the entire series.  This soapy-fun Netflix series is, at its core, about dating...albeit in a frightening and murderous way.  And dating, at its core, is about food - so it was inevitable that there end up being some delectable food porn in this stalker-rom-com.  Today, we explore not only the passionately-prepared roast chicken, but the idea of the perfect bite itself!']","['INGREDIENTS', 'The Perfect Bite, Chicken:', '1 whole chicken, preferably heritage and air-chilled', '6 ounces butter', '1 Tbsp finely minced parsley', '1 Tbsp finely minced rosemary', '1 Tbsp finely minced thyme', '3 lemons', '2 heads of garlic', 'Kosher salt', 'Freshly ground pepper', 'The Perfect Bite, Fingerling Potatoes:', '1 cup canola or vegetable oil', 'Kosher salt', 'Freshly ground pepper', 'Yellow fingerling potatoes (your desired quantity)', '6 cloves garlic, crushed', 'Sprigs of thyme and rosemary', 'Lemon zest', 'The Perfect Bite, Carrots:', '6-8 carrots', 'Olive oil', 'Kosher salt', 'Freshly ground pepper', 'The Perfect Bite, Balsamic Reduction:', 'Balsamic vinegar', 'Jess’s Perfect Bite, Duck Carbonara:', 'Kosher Salt', 'Sugar', 'Duck eggs (3 yolks, 4 whole eggs)', 'Freshly ground pepper', 'Maple syrup', 'Pink curing salt', 'Water', '2 duck breasts', 'Cherry & Applewood chips (for smoking)', '150g all-purpose flour', '150g durum semolina flour', 'Olive oil', 'Grated pecorino-romano cheese', '2 garlic cloves']","['Method', 'The Perfect Bite: Chicken, Potatoes, Carrots & Balsamic Reduction', 'Start by butterflying the chicken. Snip out the spine and place a strategic cut at the base of the breastbone so that you can crack it open and lay it out flat.', 'Run your fingers underneath the skin, separating the skin from the meat.', 'Combine finely minced herbs (parsley, rosemary, thyme) with 6 ounces of butter. Add a pinch of kosher salt and freshly ground pepper. Mash together until fully mixed. ', 'Once the butter and herbs are homogenous, start rub the butter underneath the skin. This seasons the meat. Also rub the butter on the outside of the bird, to be true to the show. Once covered, start poking the chicken all (over especially the fat deposits), which will help the fat better render out as it roasts. ', 'On a baking sheet, lay the chicken on top of 3 halved heads of garlic and thick slices of lemon. Rub the chicken down with more butter before placing the pan into a 450°F oven for about 45 minutes. ', 'In a pot, place a handful of yellow fingerling potatoes in cold water and then bring to a boil. Cook for about 15 minutes, or until a paring knife enters with ease. Place potatoes onto a rimmed baking sheet to cool off for about 10 minutes. Once cooled off, place another rimmed baking sheet on top and squash them by pressing down. This will make them crispy when fried.', 'For the cooking oil, place about a cup of canola or vegetable oil in a small saute pan with some crushed cloves of garlic and fresh herbs of choice. Cook over medium-low heat until bubbling and the garlic is lightly browned. Strain the oil into the intended potato cooking pot. Bring the oil up to 375°F. Drop in the potatoes and fry, flipping after 2-3 minutes, or until golden brown.', 'Let the potatoes drain on a wire rack and keep them in a low oven to keep them warm while finishing cooking the rest of the ‘perfect bite’. ', 'Using the fried garlic from the oil, make a flavor paste by combining the garlic with some freshly grated lemon zest. Place into a large bowl along with the potatoes, a pinch of kosher salt, and a few twists of freshly ground black pepper. Toss until completely seasoned.', 'For the carrots, peel (chop in half if they’re a little too thick) and place onto a rimmed baking sheet with a little olive oil, kosher salt, and some freshly ground black pepper tossing to combine. Once combined, place into a 400°F oven for 30 minutes until nicely browned. ', 'After 45 minutes or when the thickest part of chicken registers at 155°F, let the chicken rest for at least 30 minutes at room temperature uncovered. ', 'For the balsamic reduction, place a cup of high quality balsamic vinegar in a saute pan bringing to a simmer over medium-high heat until reduced by half and thick and syrupy. It should be able to easily coat the back of a spoon. ', 'Before plating up, carve up your chicken by cutting it in half at the breastbone. Slice a skin-on boneless breast to plate alongside the crispy potatoes and carrots. Top with balsamic reduction (maybe).', 'Duck Carbonara', 'First, cure some duck eggs yolks by mixing equal amounts of kosher salt and sugar. Pour the salt/sugar mixture into a pie plate, making little divots to place the egg yolks. Add 2 duck egg yolks into their respective divots and top them with more of the sugar/salt mixture. ', 'Once the duck egg yolks are covered in sugar and salt, cover with plastic wrap and refrigerate for at least 3 days, and up to 6 days. ', 'After their salt cure, the yolks will have firmed up considerably. In order to grate them like cheese, place into a low oven or dehydrator at 150°F for 2 hours, until dry and firm throughout. ', 'Now it’s time to to cure the duck breasts. Start by combining 4 teaspoons each of kosher salt and freshly ground pepper, 5 teaspoons of granulated sugar, 1 Tablespoon of maple syrup (or blackstrap molasses), and ¾ teaspoons of pink curing salt (or prog powder number 1).', 'To this we’re going to add about 2 cups of distilled room-temperature water and whisk until most of the particulate is all but dissolved.', 'In a pie pan, place 2 duck breasts and pour the duck cure over the breasts until they are submerged. Wrap the whole thing in plastic wrap and refrigerate for at least a day and up to 3 days, and flipping every 12 hours. After a few days your duck breasts should have firmed up significantly the same way that pork belly would. ', 'Thoroughly rinse and pat the breasts dry before smoking them.', 'Prepare your smoking method of choice. I’m using a stovetop smoker with some cherry and applewood chips. I’ve wrapped the stovetop smoker tightly in aluminium foil. I’m letting it cook at about 225°F for about 2 hours until the thickest part of the breast registers at 150°F. Once finished, place in the fridge and let chill completely before using. ', 'For the duck egg pasta, mix 150 grams each of all-purpose flour and durum semolina flour, 3 grams of kosher salt and whisk together. Make a well in the center, and crack 2 duck eggs (should be about 1 20 grams). If the eggs didn’t weigh enough, make up the weight with olive oil. Beat into a slurry using a fork, taking in little bits of flour with each turn, until it’s nice and thick and ready to be mixed by a paddle. ', 'Mix this all together in a stand mixer with the paddle attachment for 1-2 minutes, until all the liquid has been absorbed by the flour, but it’s still pretty dry and crumbly. Wrap in plastic wrap and let it rest for 20 minutes before kneading by hand into a smooth taut ball.', 'Extrude the pasta dough through an extruder into your desired shape.', 'Once you have extruded all of your pasta into your preferred shape, cover with plastic wrap and refrigerate until ready to use or freeze for a later date. ', 'Cut up your duck bacon into large chunks and place it into a cold pan and slowly crisp over medium heat in order to render out as much fat as possible. ', 'Meanwhile, to make the carbonara custard, crack 2 duck eggs plus 1 extra duck egg yolk and beat until homogenous. Add a cup of freshly grated pecorino romano cheese along with a few twists of freshly ground pepper and beat to combine. ', 'Once the bacon is crisp, add 2 cloves of crushed garlic to the pan, cooking for 1 minute over medium-low heat until fragrant. While that is going, add the pasta to boiling water for no longer than 90 seconds. Kill the heat under the frying pan and the pasta to the frying pan and toss in the duck bacon and duck bacon fat.', 'In a preheated metal bowl, pour the pasta along with the egg and cheese mixture, also a generous pinch of kosher salt and a ¼ cup of pasta cooking water (more if necessary). Toss this rigorously.', 'Twist into pretty little nests with a carving fork and soup ladle then generously grate our cured duck egg yolks over top before eating. ']",https://www.bingingwithbabish.com/
100037,Instant Mac and Cheese inspired by Once Upon a Time in Hollywood,https://www.bingingwithbabish.com/recipes/instant-mac-cheese,https://images.squarespace-cdn.com/content/v1/590be7fd15d5dbc6bf3e22d0/1580843161902-ICU17MOOXSOR218T5WZF/ke17ZwdGBToddI8pDm48kB22_VvoyFCRbPbLc__z6BN7gQa3H78H3Y0txjaiv_0fDoOvxcdMmMKkDsyUqMSsMWxHk725yiiHCCLfrh8O1z4YTzHvnKhyp6Da-NYroOW3ZGjoBKy3azqku80C789l0s0XaMNjCqAzRibjnE_wBllWPKxPwXRrgPSJ9-HJGJRIPBbQUFoxZAAiruvptd7uDw/Mac+and+Dehydrated+Cheese+Powder.jpg?format=500w,2020-02-04,"[""In Quentin Tarantino's latest drug-laced, blood-soaked, profanity-peppered revisionist history masterpiece, food once again takes center stage alongside our singular protagonists. In a departure from his penchant for fictional brand names, a familiar box emblazoned in blue is shown as the preferred dinner of stuntman Cliff Booth. Can we improve on this childhood classic? Is there even a need to? Well, I decided to anyway. Sort of.""]","['INGREDIENTS', 'Mac and Powdered Cheese', '21 grams powdered cheddar cheese', '5 grams powdered blue cheese', '10 grams powdered parmesan cheese', '5 grams buttermilk powder', '20 grams butter powder', '170 grams elbow noodles', 'Leftover pasta (about ¼ cup)', 'Mac and Dehydrated Cheese Powder', '6 slices cheddar cheese', '½ cup parmesan cheese, shredded   ', '½ cup gruyere cheese, shredded', '6 slices white American cheese', '6 slices yellow American cheese', 'Kosher salt', '1 Tbsp buttermilk powder', '2 Tbsp butter powder', '300 grams all-purpose flour', '5 grams kosher salt', '1 large egg', '80 grams water', '10 grams olive oil', '½ cup leftover pasta water']","['Method', 'Mac and Powdered Cheese', 'Add all powders together in a small bowl. Stir to combine.', 'Bring a pot of water to a boil. Add elbow noodles to water and cook for 5 minutes.', 'Drain water from pasta, reserving about ¼ cup in the pot.', 'Add the powder mixture to the pot. Stir to combine.', 'Serve and enjoy!', 'Mac and Dehydrated Cheese Powder', 'Arrange cheese in a dehydrator and let dehydrate for 12 hours at 120°F. Remove dehydrated cheese from their racks.', 'Lay the cheddar cheese out on a baking sheet lined with a paper towel. Cover with another layer of paper towels. Put another baking sheet on top and press down to remove any excess moisture from the cheddar.', 'Put the cheddar cheese in the freezer for 30 minutes.', 'Add the cheddar to a high-powered blender. Blend on high speed for about one minute, until it is a fine powder. ', 'Add cheese powder to a plastic bag with a food grade desiccant. This will help keep the cheese powder stable in your fridge.', 'With the rest of the cheeses (parmesan, gruyere, white American, yellow American), add each one individually to the blender. Blend on high speed for one minute, or until it is a fine powder. Store individually in labeled plastic bags with a food grade desiccant.', 'Make your blend of cheese powder by combining equal parts cheddar, yellow American, and gruyere. Add half a part of parmesan. This will make for a nice balance of texture and flavor.', 'Add a large pinch of Kosher salt along with 1 tablespoon buttermilk powder and 2 tablespoons butter powder. Stir to combine.', 'Pass the powder mixture through a fine mesh sieve to get rid of any clumps.', 'To make the homemade macaroni noodles, add the all-purpose flour, kosher salt, egg, water, and olive oil to the bowl of a stand mixer.', 'Beat the dough over medium-low speed with the stand mixer’s paddle attachment. It should barely come together to form a cohesive dough. It should also be able to break apart easily.', 'Press the dough into a disc and wrap in plastic wrap. Let sit at room temperature for 30 minutes.', 'Dust a baking sheet with plenty of flour. Break off a few walnut-sized pieces of dough and roll them into balls, using the floured baking sheet.', 'Get your stand mixer ready with the bucatini pasta attachment on the highest speed.', 'Feed balls of dough into the extruder. As pasta starts to come out, snip it off once it is the length of macaroni noodles.', 'Every 50 or so noodles, be sure to toss them in flour and set them aside as you continue making the rest.', 'Remove the excess flour from the noodles using a fine mesh sieve.', 'Add pasta noodles to a pot of boiling water and cook for about 90 seconds, or until tender and al dente.', 'Drain the pasta, reserving about ½ cup of pasta water on the side.', 'Add your dried cheese powder mixture to the drained noodles. Stir to combine and add pasta water slowly as needed to help the sauce come together.', 'Serve and enjoy!']",https://www.bingingwithbabish.com/
