b_with_b_id,recipe_name,recipe_link,recipe_thumbnail,date_published,recipe_description,recipe_ingredients,recipe_directions,external_url
100143,The Every-Meat Burrito inspired by Regular Show: 2 Million Subscriber Special,https://www.bingingwithbabish.com/recipes/2017/8/22/everymeatburrito,https://images.squarespace-cdn.com/content/v1/590be7fd15d5dbc6bf3e22d0/1516207161814-4J5A365BVA49ACP4SWAR/ke17ZwdGBToddI8pDm48kLSxtMMBVAcfCT-9ahk6REAUqsxRUqqbr1mOJYKfIPR7LoDQ9mXPOjoJoqy81S2I8N_N4V1vUb5AoIIIbLZhVYxCRW4BPu10St3TBAUQYVKc-T3ily9mq0oKW-azm5MQdNxrKbA5Wr8UWddpCJ0W47BhFlDAJyl73ilTSeb-5EFK/Screen+Shot+2018-01-17+at+10.31.35+AM.png?format=500w,2018-01-16,"[""This week we're celebrating hitting 2 million subscribers with maybe the most cartoonish cartoon food ever imagined: the every-meat burrito. While we were unable to procure any giraffe, jackal, or naked mole rat, the combination of every commercially-available meat ended up tasting like something far worse than chicken. Follow along as we get that taste out of our mouth with the every-pork burrito!""]","['INGREDIENTS', 'Big tortillas', 'Chicharron', 'Carnitas', 'Chorizo', 'Al pastor', 'Bacon', 'Baking soda', 'Salt', '1 orange', 'Serrano peppers, halved', 'Vegetable oil', 'Whole onion, chopped', 'Pepper', '4 bay leaves', '6 whole cloves, halved', '2 cinnamon sticks', 'Bamboo skewers', 'Pineapple', '2 limes', '2 cups long grain white rice', 'Salsa', 'Sour cream', 'Monterey jack cheese', '  Spice Paste', '5 guajillo chiles', '5 pasilla chiles', 'Onion powder', 'A few cloves of garlic', 'Shake of cumin', 'Mexican oregano', 'Ground annatto seeds', ' ']","['For Chicharron', 'Cover meat in baking soda and salt and refrigerate on a rack for 2-24 hours.', 'Once removed from the fridge, cut the pork belly into half inch pieces.', 'Place the meat in a wok and barely cover with water, bring to a boil, and skim off any scum that comes to the surface for the next 2-4 hours.', 'Cook down until pork belly is rendering in its own fat.', 'Spice Paste', ""Boil the guajillo and pasilla chiles for about 15 minutes or until they're nice and soft."", 'Strain them and reserve their boiling liquids.', 'Remove the seeds from each pepper.', 'Return the peppers to the liquid once they’ve been deemed seedless.', 'Add peppers to a high powered blender with a shake of onion powder, a few cloves of fresh garlic, a little shake of cumin powder, a generous pinch of Mexican oregano, and a spirited sprinkling of freshly ground annatto seeds', 'Blend on high for about 1 minute.', '', ' Al Pastor', 'Break down pork shoulder into slices no thicker than ¼ inch.', 'Once broken down, add pork to a bowl along with spice paste marinade and gently massage until all the meat is coated.', 'Cover bowl in tin foil and place in the fridge for 2-3 hours.', 'Cut the pineapple at the bottom so you have a piece that is about 2 inches tall. Place two bamboo skewers next to each other. Place meat over the skewers making a makeshift shawarma.', 'Cut the top of the pineapple and place that on top.', 'Place in a 350° oven, right up against the side wall of the oven, rotating frequently to get that charred shawarma effect.', 'Remove from oven and shave off meat much like a shawarma, and set aside.', 'Carnitas', 'Preheat oven to 275°', 'Add carnitas to a baking dish.', 'Cut one orange into quarters and squeeze the juice over the carnitas. Take the squeezed orange flesh and add to the mixed meat mixture.', 'Add 2 serrano peppers (halved) to the mixture along with a whole onion (chopped), a generous pour of vegetable oil,  kosher salt, and pepper.', 'Also add 4 fresh bay leaves, 6 cloves of garlic (halved), and 2 cinnamon sticks.', 'Mix everything together and cover in tin foil.', 'Place in the oven for 3 ½ hours.', 'Once cooked, uncover, and remove meat from spices. Start shredding until all carnitas is shredded.', 'Set aside and refrigerate until needed.', 'Rice', 'Take 3 cups of boiling water, adding 2 squeezed limes and a shake of cumin along with 2 cups of long grain white rice in a casserole tightly covered with aluminum foil and bake for 20-25 minutes at 400°.', 'Burrito', 'Cook some bacon in a pan. Remove bacon and use the fat to crisp up Chicharron and carnitas.', 'Take a large tortilla and spread down a base layer of white lime rice and a few slices of our chorizo sausage.', 'Next add the crispy chicharron and carnitas. Then comes the al pastor. Top that with some monterey jack cheese, salsa, sour cream and bacon.', 'Roll up and enjoy!']",https://www.bingingwithbabish.com/
100144,Moroccan Pasta inspired by Peep Show,https://www.bingingwithbabish.com/recipes/2017/8/22/moroccanpasta,https://images.squarespace-cdn.com/content/v1/590be7fd15d5dbc6bf3e22d0/1515534380690-5XPFVGTIMF03R60VVLWO/ke17ZwdGBToddI8pDm48kKxeAm3QxQWEesN9qEZQU8UUqsxRUqqbr1mOJYKfIPR7LoDQ9mXPOjoJoqy81S2I8N_N4V1vUb5AoIIIbLZhVYxCRW4BPu10St3TBAUQYVKcht_QE_R7oaz7dxZ0MxWKcuwE9-0qy_741_arasd45xS366UOw3q19D89JIpq5EG9/Screen+Shot+2018-01-09+at+3.41.43+PM.png?format=500w,2018-01-09,"[""Mark Corrigan, when he's not committing social atrocities in front of his friends, family, employers, coworkers, or random strangers, often commits them in front of the various loves of his life. In his latest desperate ploy for domestic bliss, he mashes together his romantic cheesy pasta dinner with some hastily procured pantry items - with lots of lettuce. Start 2018 off on a painfully awkward note with Mark's 'Moroccan' pasta and cocktails.""]","['INGREDIENTS', '1 can of garbanzo beans', 'Salt', 'Olive oil', 'Sweet paprika', 'Small onion, diced', 'Small red pepper, diced', '1 clove of garlic', 'Pinch of cumin', 'Pinch of smoked paprika', 'Hefty shake of cayenne', 'Generous jostling of turmeric', '28 ounce can of whole tomatoes', '½ cup feta cheese', 'Butter', 'Eggs', 'Spinach']","['Method', 'Garbanzo Beans', 'Rinse and dry one whole can of garbanzo beans. Toss them in a bowl with olive oil and salt. Then spread them evenly on a parchment lined baking sheet and roast on 400° for 20-30 minutes or until brown and crisp.', 'Transfer beans to a bowl and toss them with plain sweet paprika and set aside.', 'Moroccan Ragu', 'Start by putting some olive oil in a pan and sauté a small diced onion, a small diced pepper, and one crushed clove of garlic. Let them sweat it out until fragrant and translucent.', 'Add pinch of cumin, a pinch of smoked paprika, a hefty shake of cayenne, and a generous jostling of turmeric. Let these flavors get to know each other a little bit before adding a 28 ounce can of whole tomatoes.', 'Smash them up and stew them down for about 30 minutes until the harsh raw tomato flavor has gone away.', 'Thoroughly puree the tomato sauce in a high powered blender until extremely smooth.', 'Set aside about half the sauce in a small saucepan to keep warm and in the remaining half add ½ cup of feta cheese. Process to combine.', 'Butter 2 ramekins and set aside.', 'Cook one box of pasta or make your own (which you can learn how to do here on Basics With Babish) and add pasta to the feta sauce. Toss to combine and twirl up some pasta into the buttered ramekins.', 'Using a fork and spoon, put the pasta to the sides, creating a hole in the middle. Then bake at 400° for 10 minutes.', 'Remove ramekins from the oven and run a small paring knife around the outside of the ramekin to loosen it. Crack an egg in each of the wells you created and place back in the oven to bake for 10-15 minutes until the whites are set but yolks are runny.', 'Invert pasta in ramekin onto an interim plate while we start plating.', 'Spoon some of the non-feta sauce into a pool on the bottom of the plate and top with sautéed spinach.', 'Place pasta with egg on top and add some of the garbanzo beans as a delicious garnish.', 'Sautéed Spinach', 'Add olive oil and crushed garlic to a saucepan.', 'Add spinach, salt and pepper, and cook to desired tenderness.']",https://www.bingingwithbabish.com/
100145,Skinner's Stew inspired by The Simpsons,https://www.bingingwithbabish.com/recipes/2017/8/22/skinnersstew,https://images.squarespace-cdn.com/content/v1/590be7fd15d5dbc6bf3e22d0/1516812440313-JV9MT1P56U3UHURD2UED/ke17ZwdGBToddI8pDm48kGHkoB6G9h1GSjTM9QhX-tEUqsxRUqqbr1mOJYKfIPR7LoDQ9mXPOjoJoqy81S2I8N_N4V1vUb5AoIIIbLZhVYxCRW4BPu10St3TBAUQYVKcJHc4Vu-fXr7JOVS8JFUJDNHV5r4BHCFlhPnI_RJaRAvkVERVUinqgieBLZRPSNTx/Screen+Shot+2018-01-24+at+10.46.02+AM.png?format=500w,2018-01-09,"[""While Seymour Skinner's tour in Vietnam sounds a bit cushy, there's no doubt that he's dutifully served our country - more so by even trying to get Bart Simpson through middle school. As the cold weather makes its final offense, indulge in the 4-rice 2-seafood stew of Skinner's shellshocked memory - or cram some neon-colored cheese into a sandwich and pretend you're Ralph Wiggum.""]","['INGREDIENTS', 'Brown Rice', 'Red Rice', 'Jasmine Rice', 'Green Jade Rice', 'Prawns', 'Scallions', 'Olive oil', 'Prawn shells', 'White wine', 'Water', 'Shiitake mushrooms', 'Minced garlic', 'Minced ginger', 'Minced lemongrass', 'Minced shallot', 'Trimmed green beans', 'Lime leaves (or fresh squeezed lime)', '2 Tbsp green curry paste', 'Bamboo shoots', 'Sliced red pepper', ""Thai bird's eye chillis (optional)"", 'Fish sauce', '1 can of cocount milk', 'Thai basil or regular basil', 'Monk fish', 'Ground cardamom', 'Cayenne pepper', 'Pinch of brown sugar', ' ']","['Method', 'Cook 1 cup of each type of rice (brown, red, jasmine, and green jade).', 'Place all 4 rices in a casserole side by side covered with tin foil in a 200° oven -- keeping everything warm while we make the stew.', 'Shell and devein some prawns but do not throw away your prawn shells! We are going to use them for the broth.', 'Add some scallions to a saucepan that has oil preheated over medium high heat. Add our prawn shells and sauté until the shells start to show some color, at which point deglaze the pan with a few glugs of white wine and 1-2 cups of water.', 'Let simmer for about 45 minutes, then drain and set aside.', 'Add minced garlic, minced ginger, minced lemongrass, minced shallot, some trimmed green beans and some chopped shiitake mushrooms to a saucepan preheated with olive oil and sauté until fragrant. Deglaze with some of the broth, and add some lime leaves (or 1 fresh squeezed lime). Also add 2 Tbsp of green curry paste and sauté, letting all the flavors get to know each other. Then add bamboo shoots, some sliced red bell pepper, fish sauce, and 2-3 cups of shellfish broth.', 'Let cook for a minute, then add 1 can of coconut milk along with some Thai basil or regular basil.', 'Add in monk fish and prawns, and give a good stir.', 'Add in ground cardamom, cayenne pepper and a pinch of brown sugar. Cover and poach for 5-10 minutes, or until everything is cooked through.', 'Remove rice from the oven and in a small bowl add one scoop of each rice, followed by your stew.', 'Eat and enjoy!']",https://www.bingingwithbabish.com/
100146,The Wire Special,https://www.bingingwithbabish.com/recipes/2017/6/27/thewirespecial,https://images.squarespace-cdn.com/content/v1/590be7fd15d5dbc6bf3e22d0/1515534519460-OUFMDI2Q72158JMOPH2G/ke17ZwdGBToddI8pDm48kM63SRb8_1XRwKpZQKtnRikUqsxRUqqbr1mOJYKfIPR7LoDQ9mXPOjoJoqy81S2I8N_N4V1vUb5AoIIIbLZhVYxCRW4BPu10St3TBAUQYVKc4A6iLnIm-dtQJPfUKytjuMzTub1ipkXeYFVhMsmrvD-1df1ZzIGEtbpe7ecAKCOo/Screen+Shot+2018-01-09+at+11.28.48+AM.png?format=500w,2017-12-26,"[""The Wire, when it's not mercilessly killing off characters you've come to love and care about, is a showcase of Baltimore junk food specialities. Lake trout, pit beef, eggs cracked into beers - come for the gritty and heartbreaking depictions of heroin addicts and inner city grade schoolers, stay for the eats!""]","['INGREDIENTS', '2 deboned fish (whiting, cod, haddock, or halibut)', 'Flour', 'Corn meal', 'Garlic powder', 'Onion powder', 'Cayenne pepper', 'Old Bay', '4 cups of whole milk', '2 eggs', '3 peeled potatoes', '2 pinches of salt', '2 slices of white sandwich bread', 'Hot sauce']","['Method: Fish Dish', 'For the fish:', 'Make sure both of of your pieces of fish are deboned.', 'Combine flour, corn meal, garlic powder, onion powder, cayenne pepper, and Old Bay in a pan and thoroughly mix to create dry batter.', 'Pour 4 cups of whole milk, 2 eggs, garlic powder, onion powder, Old Bay and cayenne pepper into another pan and mix with a fork to create wet better.', 'Dunk fish into wet batter first, then in the dry after. Make sure to thoroughly coat fish in the dry batter.', 'Place fish in the fryer with the oil heated to 350° F for 8-10 minutes until golden brown and crisp.', 'Thick-cut fries:', 'Slice potatoes into thick steak fries.', 'Fry them in 350° F vegetable oil until they turn blonde.', 'Drain on a paper towel lined baking sheet, then separate them and freeze for 24 hours.', 'After chilling, refry for another 5-7 minutes until golden brown and super crisp.', 'Add kosher salt and toss while fries are still hot.', 'Place fries and 2 slices of white sandwich bread onto the plate.', 'Place your fried fish over top of the bread and fries, then cover in hot sauce.']",https://www.bingingwithbabish.com/
100147,Peking Duck inspired by A Christmas Story,https://www.bingingwithbabish.com/recipes/2017/8/22/pekingduck,https://images.squarespace-cdn.com/content/v1/590be7fd15d5dbc6bf3e22d0/1515517767583-QV5FHRWDEYL5TIMHQFWD/ke17ZwdGBToddI8pDm48kDZmIJ1yh6ot9Skcu_xE52wUqsxRUqqbr1mOJYKfIPR7LoDQ9mXPOjoJoqy81S2I8N_N4V1vUb5AoIIIbLZhVYxCRW4BPu10St3TBAUQYVKcb0SA4Gf8GeHmyDWSobP-CkNr6VNYEw5vnovCg8eaR0eudYAFbvf26xvvSl5QrSxz/Screen+Shot+2018-01-09+at+11.09.03+AM.png?format=500w,2017-12-19,"['A Christmas Story, beyond its bunny suits and leg lamps, is fondly remembered by Generation X-ers for its unfortunate portrayal of Chinese-Americans, and their alluring turkey alternative: peking duck. Crisp skin, juicy meat, deep flavor, all wrapped up in a Mandarin-style pancake with thinly sliced cucumbers, scallions, and hoisin sauce? Fa la la la la, la la la la. ']","['INGREDIENTS', 'Ingredients:', 'Cinnamon', 'Clove', 'Star anise', 'Fennel seed', 'Szechuan peppercorns', 'One head-on young Peking duck', 'Soy sauce', '2 Tbsp honey', 'Small knob ofgGinger', 'A clove of garlic', '2 tsp seasoned rice vinegar', '2 tsp sesame seed oil', '1 Tbsp chili-garlic sauce', '2 Tbsp smooth peanut butter', 'Ground black pepper', 'About 2 Tbsp brown sugar', 'Cornstarch', 'Cucumber', 'Scallions', 'For Mandarin Style Pancakes:', '10 ounces all purpose flour', 'Sesame oil']","['Method', 'Method:', 'Begin by making a Chinese five-spice mixture by toasting some cinnamon, clove, star anise, fennel seed, and szechuan peppercorn in a dry skillet until fragrant and then grinding', 'them to a fine powder.', 'Next, make a hoisin sauce by combining 4 Tbsp of soy sauce, 2 Tbsp of honey, a small knob of freshly grated ginger, a clove of freshly grated garlic, 2 tsp of seasoned rice vinegar, 2 tsp of sesame seed oil, 1 Tbsp of chili-garlic sauce, 2 Tbsp of smooth peanut butter, a few solid pinches of the Chinese five- spice mixture, ground pepper, and about 2 Tbsp of brown sugar.', 'If the sauce gets too thin, thicken with cornstarch.', 'Dump about half of the hoisin sauce into the cavity of the duck and stitch it closed using a bamboo skewer.', 'Now, in order to separate the skin from the meat, insert an air compressor tip (covered with the finger of a rubber glove with a hole in the tip) into the neck skin of the duck.', 'Inflate the skin enough to peel it away from the duck meat.', 'Boil about 4 cups of water with about ¼ cup of soy sauce and some of the Chinese five-spice mixture.', 'Ladle the boiling mixture onto the duck until the skin takes a nice golden color and tightens up considerably.', ""Let the duck rest in the fridge uncovered for at least one day and ideally 3 days. If you're pressed for time, dry out the skin with a hair dryer."", 'Roast the duck at 350°F for 1 to 1 ½ hours.', 'While the duck roasts, make a Mandarin-style pancake by combining 2/3 of a cup of boiling water with 10 ounces of all-purpose flour until a shaggy dough forms.', 'Turn the dough out on a floured work surface and knead until smooth and supple.', 'Roll into a 2-inch log and divide into 24 pieces.', 'Cover the pieces in plastic wrap until ready to use them.', 'When ready to use, divide one piece at a time in half and roll both halves into 3-inch round pieces.', 'Brush one side with a light layer of sesame seed oil.', 'Sandwich the oiled sides together and role the whole thing into a 7 to 9 inch pancake.', 'Toast the pancake in a dry pan until light brown spots begin to form.', 'Carve the duck breast meat in 1/2 inch slices.', 'Fill a pancake with finely sliced cucumber and scallions, add the duck meat and top with a bit of the hoisin sauce.', 'Enjoy!']",https://www.bingingwithbabish.com/
100148,Flanders' Hot Chocolate inspired by The Simpsons Movie,https://www.bingingwithbabish.com/recipes/2017/8/22/flandershotcocoa,https://images.squarespace-cdn.com/content/v1/590be7fd15d5dbc6bf3e22d0/1516118793116-CY88FCLYBYUNHVHXY7A0/ke17ZwdGBToddI8pDm48kO17DB85OhUUJZpXD-LN9aAUqsxRUqqbr1mOJYKfIPR7LoDQ9mXPOjoJoqy81S2I8N_N4V1vUb5AoIIIbLZhVYy7Mythp_T-mtop-vrsUOmeInPi9iDjx9w8K4ZfjXt2dmdEgGuikvL2Vw_ie8MK9qeTq3Gs-CQnmA66Zl0DfH9VCjLISwBs8eEdxAxTptZAUg/Screen+Shot+2018-01-16+at+10.05.22+AM.png?format=500w,2017-12-12,"[""Ned Flanders might be an uncomfortable source of familial affection and exaggerated Judeo-Christian values, but he's also the source of some damned fine-looking hot cocoa. In the silver-screen adaptation of America's longest-running-animated-adult-comedy-cartoon-family, Flanders continues his assault on the Simpson's way of life with a steaming mug of human kindness and empathy.""]","['INGREDIENTS', 'Ingredients:', 'Whole milk', 'Heavy cream', 'Evaporated milk', 'Sweetened condensed milk (optional - if you want an ultra-creamy hot chocolate)', '½ cup of Ghirardelli cocoa powder', '½ cup of 70% dark baking chocolate', '½ cup of sugar', 'Pinch of salt', 'Small pinch of ground cinnamon', '1 tsp of instant coffee (optional)', 'Whipped cream', 'Chocolate shavings', '1 small graham cracker', '1 marshmallow']","['Method', 'Method:', 'Add your 2 parts whole milk, 1 part heavy cream, and 1 part of', 'evaporated milk to a saucepan.', 'Heat milk and whisk while heating. Heat to steaming hot but not boiling - around 190° F.', 'Add ½ cup of Ghirardelli cocoa powder to milk. Then add ½ cup of 70%', 'dark baking chocolate and whisk together.', 'Add ½ cup of sugar and continue to whisk until everything is mixed in completely.', 'Add 1 pinch of salt and a small pinch of ground cinnamon. Add instant coffee if you would like. Whisk to combine all ingredients.', 'Pour hot chocolate into a cup and cover with whipped cream.', 'Shave chocolate on top of the whipped cream.', 'Add graham cracker to the top of the whipped cream and coat top with whipped cream.', 'Stick marshmallow on top of graham cracker. Then toast marshmallow to your liking.', 'Serve and enjoy!']",https://www.bingingwithbabish.com/
100149,Quatro Quesos Dos Fritos inspired by Psych,https://www.bingingwithbabish.com/recipes/2017/8/22/quatroquesodosfritos,https://images.squarespace-cdn.com/content/v1/590be7fd15d5dbc6bf3e22d0/1515516659614-2S57JEQFM861DNQX4G67/ke17ZwdGBToddI8pDm48kGDCcEE7MEIUGLI9MxmTTcwUqsxRUqqbr1mOJYKfIPR7LoDQ9mXPOjoJoqy81S2I8N_N4V1vUb5AoIIIbLZhVYxCRW4BPu10St3TBAUQYVKcV5j1TAO1OjqkXekdKeA5Ol5QZegdqfj5i0qHulz2kXG1m3qFEtrLBf2jDrl7M2am/Screen+Shot+2018-01-09+at+10.50.40+AM.png?format=500w,2017-12-05,"[""You thought Dulé Hill couldn't steal the show once again after his residency on the West Wing - well, back by popular demand, he's reprising his role as Burton Guster in the tv-movie revival of Psych this weekend. Revel in the duo's stoner-like propensity for hilariously unhealthy snacks with this week's recreation of a fan favorite: potatoes, stuffed with four cheeses, deep-fried, breaded, and re-fried, nestled on a bed of ancho sour cream and crispy bacon.""]","['INGREDIENTS', 'Ingredients', 'Potatoes', '3 russet potatoes', 'Olive oil', '3 Tbsp chopped butter', 'Eggs', 'Salt', 'Pepper', 'Flour', 'Sharp cheddar', 'Panko bread crumbs', 'Crispy bacon', 'Sour Cream', 'Sour Cream', 'Dried Ancho Chili powder']","['Method', 'Method:', 'Place the potatoes on a baking sheet, covering them in olive oil and poking them with plenty of holes.', 'Preheat the oven to 350°F and roast the potatoes until cooked through.', 'Cut the potatoes in half while they are still piping hot and allow the steam to escape for 15 to 20 minutes.', 'While they are still warm, run them through a potato ricer on its finest setting.', 'Chop and add the butter so that it melts in the still warm potato.', 'Add a whole egg to the butter and potato.', 'Season liberally with kosher salt and freshly ground pepper.', 'Add flour to the mixture if it is too soft to handle.', 'Mix thoroughly and cover with plastic wrap that is right down on the surface of the potatoes.', 'Chill for at least 30 minutes or until firmed up.', 'Cube some sharp cheddar cheese.', 'Wrap the cheese in the potato mixture. Next, coat the potato ball in flour, then dip it in an egg wash, and lastly dip it in bread crumbs. ', 'Heat a quart of vegetable oil to 350°F.', 'Fry those guys for 5 to 7 minutes or until browned and crisp.', 'Season generously with kosher salt.', 'Combine some dried ancho chili powder with sour cream.', 'Roast bacon in a 375°F Oven for 20 to 25 minutes until nice and crisp.', 'Put some of the sour cream mixture on a plate, sprinkle with bacon bits and finally the cheese filled potatoes on top.', 'Enjoy!']",https://www.bingingwithbabish.com/
100150,The Garbage Plate inspired by The Place Beyond The Pines (sort of),https://www.bingingwithbabish.com/recipes/2017/8/22/garbageplate,https://images.squarespace-cdn.com/content/v1/590be7fd15d5dbc6bf3e22d0/1515514486790-UHJY72CU74UTZBXJVGSQ/ke17ZwdGBToddI8pDm48kJBaazMwmAsPcbZmIsxuGekUqsxRUqqbr1mOJYKfIPR7LoDQ9mXPOjoJoqy81S2I8N_N4V1vUb5AoIIIbLZhVYxCRW4BPu10St3TBAUQYVKc1VbMXe0sPY3yd0LW6_uzlwrW9wzQUwOeKlzEOggg0nxBP7fLn5bGuPJzivuOkqst/Screen+Shot+2018-01-09+at+10.14.18+AM.png?format=500w,2017-11-28,['Go Bills.'],"['INGREDIENTS', 'Mysterious Meat Sauce', '1 cup diced onion', '1 pound ground beef', '4 ounces tomato paste', '¼ tsp ground cloves', '¼ tsp cinnamon', '¼ tsp allspice', '¼ tsp cayenne pepper', '¼ tsp ground cumin', '¼ tsp paprika', '¼ tsp garlic powder', '2 pinches salt and pepper', 'Diner Style Home Fries', '3 peeled potatoes', '3 Tbsp white vinegar', '3 pinches kosher salt', '1 Tbsp vegetable oil', '1 Tbsp butter', '1 pinch osalt', 'A teaspoon paprika (if desired)', '1 pinch pepper', 'Macaroni Salad', 'Cooked and rinsed pasta', '1 cup cut carrots', '½ cup cut celery', '½ cup chopped green onion', '1 cup parsley', '½ cup peppadew peppers', '½ tsp garlic powder', '1 pinch kosher salt', '1 pinch freshly ground pepper', 'Two spoonfuls mayonnaise', '1 spoonful sour cream', '1 Tbsp Dijon mustard', 'Other Ingredients', 'Hot dogs', 'Ketchup', 'Yellow mustard']","['Method', 'Meat Sauce', 'Sauté diced onions until soft. Set aside.', 'Take ground beef and place it in a hot pan and distribute meat evenly. Let sit for 5 minutes or until all meat is nice and brown.', 'Constantly stir to make sure the meat is fully cooked. Scrape the bottom to make sure none gets stuck. Continue to do this until you get crispy brown bits.', 'Add your tomato paste and stir around to combine.', 'Add your ground cloves, cinnamon, allspice, cayenne pepper, ground cumin, paprika, garlic powder, and stir over medium heat.', 'Add sautéed onions back to pan. ', 'Deglaze with ½ to 1 cup of water. Scrape bottom after adding.', 'Add pinches of salt and pepper to mix in then set aside.', 'Home Fries', 'First, dice 3 peeled potatoes. Set in pot and cover with cold water and add white vinegar and 3 pinches of salt.', 'Bring potatoes to a boil and cook for 5 minutes.', 'Spread on a paper towel-lined baking sheet to let cool.', 'Place 1 Tbsp of butter and 1 Tbsp of vegetable oil into a cast iron skillet. Cook potatoes in batches to keep from undercooking.', 'Add potatoes and let sit for 4 minutes or until potatoes have a golden crust on one side.', 'Repeat until potatoes are a golden crispy brown all over.', 'While warm, season potatoes with 2 pinches of kosher salt, paprika (if desired), and 2 pinches of freshly ground pepper.', 'Toss potatoes to evenly season throughout.', 'Macaroni salad', 'Cook and rinse chosen pasta.', 'In a mixing bowl, add cut carrots, celery, green onion, parsley, peppadew peppers, garlic powder, a pinch of salt, ground pepper, and toss together.', 'Add 2 spoonfuls of mayonnaise to pasta.', 'Add 1 spoonful of sour cream.', 'Add 1 Tbsp of Dijon mustard to pasta.', 'Fill half a plate with your home fries and the other half with your fresh pasta salad. Continue on to make toppings!', 'Hotdogs', 'Cut two hot dogs in half. Place them in a pan and place another pan on top. Cook throughly. ', 'Place hot dogs on top of the plate of home fries and macaroni salad.', 'Cover everything in the meat sauce you set aside earlier.', '(Optional) Slather with ketchup and yellow mustard.']",https://www.bingingwithbabish.com/
