b_with_b_id,recipe_name,recipe_link,recipe_thumbnail,date_published,recipe_description,recipe_ingredients,recipe_directions,external_url
100078,Binging with Babish 4 Million Subscriber Special: Death Sandwich from Regular Show,https://www.bingingwithbabish.com/recipes/deathsandwich,https://images.squarespace-cdn.com/content/v1/590be7fd15d5dbc6bf3e22d0/1554846869289-7ELKMQ5B0IVAMVU5DJGK/ke17ZwdGBToddI8pDm48kDivnXRkN1Sy3OJOndV7OBJ7gQa3H78H3Y0txjaiv_0fDoOvxcdMmMKkDsyUqMSsMWxHk725yiiHCCLfrh8O1z5QPOohDIaIeljMHgDF5CVlOqpeNLcJ80NK65_fV7S1UaFeaDYVxgbIT_o51bHTPiTJ4xIwNs6Xy1C4BMWban8DMW9u6oXQZQicHHG1WEE6fg/Screen+Shot+2019-04-09+at+4.52.45+PM.png?format=500w,2019-04-09,"[""A very special thank-you to Chef Masaharu Morimoto!  4 million subscribers!!  I keep hitting numbers I never imagined I'd ever reach, so I'm going to keep recreating dishes I never imagined I'd ever recreate.  This week it's the Death Sandwich from Regular Show, a pretty-plain-lookin' submarine that promises to kill you if you eat it without donning a mullet and jorts.  In the Babishian spirit of approaching pop culture repast renditions as realistically as possible, I enlist the help of a tv-chef-superstar to build a sandwich worth...dying for?  Probably not, no.  But holy shit you guys, I got to hang out with Masaharu Morimoto!!""]","['INGREDIENTS', '5 cloves fresh garlic. separated', '1 medium yellow onion, minced', '2-3 Tbsp olive oil', '¼ tsp dried red pepper flakes', '3 Tbsp tomato paste', '½ tsp dried oregano', '28 ounce can whole San Marzano tomatoes', '7 ounces of water', 'Fresh basil', 'Salt', 'Pepper', 'Fresh parsley', 'Fresh basil', '½ cup ricotta cheese', '½ cup panko bread crumbs', 'Zest of 1 lemon', '1 large egg', '2 ounces parmesan cheese', '1 pound ground pork', 'Vegetable oil', 'Submarine sandwich roll', 'Deli ham']","['Method', 'Start by making the sauce. In a sauce pan add ½ a minced onion along with some olive oil and saute for 2-3 minutes before adding 3 garlic cloves, 3 Tbsp tomato paste, ½ tsp dried oregano, and ¼ tsp dried red pepper flakes. Mix to combine for 30 seconds. ', 'Add a 28 ounce can of whole San Marzano tomatoes to the pan along with 7 ounces of water. Using a potato masher, slowly mash the tomato sauce until it’s smooth. Mix to combine. Add 1 sprig of fresh basil. Keep at a simmer over low heat for 45-90 minutes. Season with salt and pepper. ', 'For the meatballs, saute ½ a medium onion along with 2 cloves of freshly minced garlic. Once fragrant, take off heat and set aside.', 'To a large bowl add fresh parsley and basil along with ½ cup ricotta cheese, ½ cup of panko bread crumbs, the zest of 1 lemon, 1 large egg, 2 ounces of parmesan cheese and 1 pound of ground pork (or ground meat of choice), and your cooled onions and garlic. ', 'Mix everything together with your hands and then form into balls.', 'Over a medium high heat, heat some vegetable oil and then add your meatballs and brown for about 2 minutes on each side. Once they are browned, finish the cooking by adding them to a wire rack on a rimmed baking sheet and bake at 375°F for about 20 minutes. ', 'Slice your submarine roll in half lengthwise and then add a layer of sauce and top that with a row of deli ham. Next, add your meatballs and then the other half of the sandwich bread. ', 'Serve and enjoy!']",https://www.bingingwithbabish.com/
100079,Brock's Onigiri inspired by Pokémon,https://www.bingingwithbabish.com/recipes/brocksonigiri,https://images.squarespace-cdn.com/content/v1/590be7fd15d5dbc6bf3e22d0/1554241253636-BNU7ZALRY786SESPXF4L/ke17ZwdGBToddI8pDm48kJATr5DrCotDBVOqNajGyCJ7gQa3H78H3Y0txjaiv_0fDoOvxcdMmMKkDsyUqMSsMWxHk725yiiHCCLfrh8O1z5QPOohDIaIeljMHgDF5CVlOqpeNLcJ80NK65_fV7S1UahU3nH9PSkIeyM-SpgzHYmwFEVh7rplysYUJgp1Q-hFpC969RuPXvt2ZwyzUXQf7Q/Screen+Shot+2019-04-02+at+4.40.05+PM.png?format=500w,2019-04-02,"[""Okay, it's April 2nd, fun's over. This week, for reals this time, we're making onigiri: the breakfasty-lunchy-snack, ubiquitous in Japan, and virtually unheard of here in the US.  As such, some committee of suits saw fit to Americanize their portrayal on Pokémon, and a generation of these United States grew up thinking they were donuts...and the bastards made ten hundred billion dollars.  Was it worth it, 4Kids Entertainment?  Oh, it was?  No yeah you're right. ""]","['INGREDIENTS', 'Kelp', '2 cups water, divided', '3 Tbsp rice wine vinegar, separated', '3 Tbsp soy sauce', '1 Tbsp mirin', '1 Tbsp sake', 'Sesame seeds', 'Sour pickled Japanese plums, pitted (umeboshi)', '1 cup rice', '2 Tbsp sugar, separated', '1 tsp salt', 'Seaweed']","['Method', 'Start by adding the kelp to a bowl of water for 15 minutes. Remove and thinly slice into strips. Add to a saute pan along with ½ a cup of water, 1 Tbsp rice wine vinegar, 3 Tbsp of soy sauce, 1 Tbsp mirin, and 1 Tbsp sake. Cook over medium heat and bring to a simmer for about 10 minutes before adding 1 Tbsp of sugar. Sprinkle with sesame seeds, and then add kelp to a bowl and set aside.', 'Take your sour pickled Japanese plums (also known as umeboshi) and remove the pits. Give them a little chop or mash them with a fork and set aside.', 'For the rice, start by rinsing the rice multiple times to remove the stach. The first couple times you wash it, it’ll be very cloudy. Continue to wash until it almost runs clear.', 'Add rice to a rice cooker or pressure cooker along with 1½ cups of water. Cook for 7 minutes on high pressure and then release the pressure using the pressure valve. ', 'Spread the rice onto a sheet pan and drizzle with a mixture of 2 Tbsp of rice wine vinegar, 1 Tbsp sugar, and 1 tsp of salt. Give it a little mix to combine.', 'To form the Onigiri, have a small bowl of water ready because you want your hands to be wet or the rice will stick to them.', 'For the umeboshi nigiri, form the rice into a disc, add your umeboshi, and then cover the other side with another disc of rice. Form into a disc the size of a hockey puck.', 'For the kelp, form the rice into a disc, add the kelp along with another disc of rice and then form that into a triangle. ', 'Add a strip of seaweed to each of your onigiri. ', 'Serve and enjoy!']",https://www.bingingwithbabish.com/
100080,Brock's Donuts inspired by Pokémon,https://www.bingingwithbabish.com/recipes/brocksdonuts,https://images.squarespace-cdn.com/content/v1/590be7fd15d5dbc6bf3e22d0/1554241077185-FGZKMOQH8R1OVAJ4LIZA/ke17ZwdGBToddI8pDm48kEhdkHK8XObETFNYl4Z90zV7gQa3H78H3Y0txjaiv_0fDoOvxcdMmMKkDsyUqMSsMWxHk725yiiHCCLfrh8O1z5QPOohDIaIeljMHgDF5CVlOqpeNLcJ80NK65_fV7S1UfQawekJSne7mkvSJFGbH8xwP_DSf9O-yEqRyHVynM1fZDqXZYzu2fuaodM4POSZ4w/Screen+Shot+2019-04-02+at+4.36.00+PM.png?format=500w,2019-04-02,"[""Fooled you...maybe. Probably not. Is this even a joke? I don't get it.          "", 'Made you look down here though? Is that funny? This is my first time April fools-ing.']","['INGREDIENTS', 'Donut', '1 cup whole milk', '1 tsp granulated sugar (for the yeast)', '1 packet active dry yeast', '350g all purpose flour', '75g white sugar', '1 tsp table salt', '3 large egg yolks', 'Additional flour for work surface', 'Vegetable oil', 'Additional sugar (optional for coating)', 'Marzipan', '100g almond flour', '150g powdered sugar', '1 Tbsp corn syrup', 'A little bit of green and black food coloring', '2 Tbsp water', 'Glaze', '2 cups powdered sugar', '¼ cup skim milk (add more if needed)', 'Other ingredients', 'Jelly', 'Vegetable oil', 'Coconut shavings']","['Method', 'Start by heating some milk in a bowl to 110°F and then add 1 tsp of sugar along with 1 packet of active dry yeast. Stir to combine and set aside for 10 minutes.', 'In a large bowl combine 350 grams of all purpose flour with 75 grams of white sugar, and 1 tsp of table salt. Whisk to combine.', 'In the same bowl, add 3 large egg yolks and the milk and yeast mixture. Using a wooden spoon or your hands, mix dough together until it forms a large shaggy mass. Turn out onto a lightly floured surface and knead for about 8 minutes. Once dough is smooth, add to an oiled bowl, cover, and let sit for about an hour or until it’s doubled in size.', 'While the dough is proofing, add 100g of almond flour to a food processor along with 150g of powdered sugar, 1 Tbsp of corn syrup and a little bit of green and black food coloring. Turn the food processor on and slowly add 2 Tbsp of water. Add more if needed.', 'Knead until the color is uniform and then wrap and place in the fridge for 1 hour.', 'Turn dough out onto a floured work surface, pat with a little bit of flour, and then roll out to about ½ inch thickness. Cut the dough into a large rectangle, and then cut the dough into triangles.', 'Heat up vegetable oil in a cast iron skillet to 375°F.', 'Add donuts to the oil and flip constantly while they cook. Once brown, remove from oil and place on a wire rack to let cool.', 'Once cooled, use a paring knife make an entry point into the side of the donut and add your jelly with a piping bag. Once the jelly is added, coat the whole donut in glaze and then immediately place in a bowl with coconut shavings. Toss until fully coated.', 'Roll out the marzipan into a very thin sheet and then cut into small rectangular strips. Add some glaze to the marzipan to help it stick to the donut, and then stick the marzipan to the donut.', 'Serve and enjoy! ']",https://www.bingingwithbabish.com/
100081,The Swanson inspired by Parks and Recreation,https://www.bingingwithbabish.com/recipes/theswanson,https://images.squarespace-cdn.com/content/v1/590be7fd15d5dbc6bf3e22d0/1553627553487-70TYH9U12QAFB8B3E16F/ke17ZwdGBToddI8pDm48kOwrusCOFEk60cNn8t90vB97gQa3H78H3Y0txjaiv_0fDoOvxcdMmMKkDsyUqMSsMWxHk725yiiHCCLfrh8O1z5QPOohDIaIeljMHgDF5CVlOqpeNLcJ80NK65_fV7S1UeqU5oWc-s1kJtn2Lx69vxf_FTbYA5hGvq9nQGNSJ7r8m4bjm9DAHF2kOsIZRJKXnA/Screen+Shot+2019-03-26+at+2.11.56+PM.png?format=500w,2019-03-26,"[""This week we return, for the first time in 3 years, to the house that built Babish: Parks and Rec.  As summer (eventually) approaches, what could be better than celebrating Swanson-style: by wrapping some meat around some other meat.  There's only one problem: I can't seem to stop using colons in this video's description.""]","['INGREDIENTS', '2 turkey legs', '2 turkey wings', '1 ½ cups distilled water', '4 ½ tsp kosher salt', '1 ½ tsp pink curing salt', '4 ½ Tbsp dark brown sugar', 'Bacon']","['Method', 'Take your turkey and remove both wings and legs. In a large bowl combine 1 ½ cups distilled water with 4 ½ tsp kosher salt, 1 ½ tsp pink curing salt, and 4 ½ Tbsp of dark brown sugar. Whisk until everything is dissolved.', 'Take two large zip-lock bags, and in each bag add 1 turkey leg and 1 wing, along with half of your liquid in to each.', 'Place in a bowl and refrigerate for 24 hours and flip after 12 hours.', 'Bring a smoker to 325°F. Add a meat probe to the thickest point of your turkey leg and wrap the leg in thick cut butcher shop bacon and place in the smoker. If you have thinner bacon from the grocery store, wait 30 minutes before wrapping your turkey leg.', 'Smoke the legs and the wings for 3 ½ - 4 hours, making sure you rotate every 30 minutes or so. ', 'Remove turkey legs and wings from the smoker and let rest for about 10 minutes before digging in.', 'Serve and enjoy!']",https://www.bingingwithbabish.com/
100082,The Cake inspired by Portal,https://www.bingingwithbabish.com/recipes/portalcake,https://images.squarespace-cdn.com/content/v1/590be7fd15d5dbc6bf3e22d0/1553024401953-28BJP9WEPGC25N3VYPU6/ke17ZwdGBToddI8pDm48kN7brybtEWVUSkjW2SmFiz57gQa3H78H3Y0txjaiv_0fDoOvxcdMmMKkDsyUqMSsMWxHk725yiiHCCLfrh8O1z5QPOohDIaIeljMHgDF5CVlOqpeNLcJ80NK65_fV7S1Ue4nZJ-hqnzZ-26L5-xxVcI05LcRsDenhNiLYyTmMC5P7zs2yPjc1ECvpa5Zm_kMqw/Screen+Shot+2019-03-19+at+2.39.40+PM.png?format=500w,2019-03-19,"['The cake, as they say, is a lie.  But this one isn\'t: a classic black forest gateau, soaked in kirsch and laden with cherries, served entirely without fish-shaped solid waste.  Stick around after the show for a sneak peek at ""Being with Babish"", premiering March 22nd!']","['INGREDIENTS', '8 medium eggs (6 large eggs)', '5 ½ ounces granulated sugar', '2 tsp vanilla extract', '3 ½ ounces all purpose flour', '2 ounces cocoa powder', '3 Tbsp butter, melted', '1 jar morello cherries, stemmed and halved', '1 ½ cups powdered sugar, divided', '2 Tbsp cornstarch', '¼ cup Kirsch', '2 pints heavy cream', '2 cups shaved chocolate']","['Method', 'In a stand mixer, add 8 medium eggs (or 6 large eggs), 5 ½ ounces of granulated sugar, and 2 tsp vanilla extract. Whisk for about 8 minutes. On a piece of parchment paper, sift 3 ½ ounces of all purpose flour and 2 ounces of cocoa powder. Slowly add to whipped eggs and mix with the paddle attachment for about 2 minutes before adding 3 Tbsp of melted butter. ', 'Oil two cake pans and then line the bottoms with parchment paper and oil that as well. Split batter between the two pans. Place in a 350°F oven for 30 minutes. Set aside and allow to cool completely. ', 'Strain 1 jar of morello cherries, but save the juice. Stem and cut each cherry in half. Over a medium high heat in a medium saucepan, add your cherries along with ½ cup powdered sugar, 2 Tbsp cornstarch, ½ cup of the cherry juice, and ¼ cup Kirsch. Mix to combine and cook until it all becomes a syrup consistency. Place in a bowl and set aside.', 'Remove cakes from cake pans. Cut each cake in half, making 4 total layers of cake.', 'In a stand mixer combine 2 pints of heavy cream and 1 cup of powdered sugar. Combine until you have whipped cream. Set aside.', 'Place a little whipped cream down to help the cake not slide and then top ½ of the round with some Kirsch followed by whipped cream and cherries. Top with the next cake round along with more whipped cream and cherries. The amount of layers is up to you, I added 3 layers of cake rounds. Once you add your last round, cover the entire cake with whipped cream. ', 'If you’re making chocolate shavings, scrape your knife across the top of a chocolate bar of choice to make it into curly shavings. You can also buy chocolate shavings if you’d prefer.', 'Add your chocolate shavings to the entire cake on top of the whipped cream. You may want to use gloves to help with the chocolate melting. Once the cake is completely covered, use a piping bag and whipped cream to make some flower blossoms on top of the cake and top each of those with a cherry.', 'Slice it up, serve and enjoy!']",https://www.bingingwithbabish.com/
100083,Ribwich inspired by The Simpsons,https://www.bingingwithbabish.com/recipes/ribwich,https://images.squarespace-cdn.com/content/v1/590be7fd15d5dbc6bf3e22d0/1553024810657-Q55SPRIC5YHPRU33PH8J/ke17ZwdGBToddI8pDm48kOo15ooJtXLiqkIcWszWBlQUqsxRUqqbr1mOJYKfIPR7LoDQ9mXPOjoJoqy81S2I8N_N4V1vUb5AoIIIbLZhVYxCRW4BPu10St3TBAUQYVKcnZPv6xi00pn46j-bIRKSXIwHKtw0_ZrIpSX97CMYgk1I3kXf3qLIL0xvRewjaYo3/Screen+Shot+2019-03-19+at+2.46.39+PM.png?format=500w,2019-03-12,"['This week we return, once again, to the seemingly bottomless pit of pop culture food parody that is The Simpsons. Never one to shy away from making fun of McDonalds, America\'s favorite family now grapples with an otherworldly force known as the \'Ribwich\'. I was going to make a ""rib"" patty, like they would in a fast food context, but I\'m just getting out from under the flu and didn\'t want to. I\'m sorry.']","['INGREDIENTS', 'Dry Rub', '1 cup dark brown sugar', '1 Tbsp chili powder', '1 tsp dry mustard', '½ tsp cayenne pepper', '1 tsp smoked paprika', '1 tsp garlic powder', '1 tsp paprika', 'Salt', 'Pepper', 'Wet Rub', '1 cup mustard', '¼ cup ketchup', '¼ cup liquid smoke', 'Barbecue Sauce', '½ onion, grated', '3 cloves garlic, crushed', 'Vegetable oil', '1 Tbsp chili powder', '1 cup ketchup', '2-3 Tbsp molasses', '2 Tbsp dijon mustard', '1 tsp Worcestershire sauce', '1 tsp cayenne pepper', '2 Tbsp apple cider vinegar', '2 tsp smoked paprika', 'Everything Else', 'Ribs ', 'Buns', '½ onion, chopped', 'Pickles, chopped', '6 bags lapsang tea', '1 beer', 'Aluminum foil']","['Method', 'Start by preparing your dry rub by combining all of the dry rub ingredients and whisking them to combine. Set aside.', 'Next, prepare your wet rub by combining 4 parts mustard to 1 part ketchup along with 1 part liquid smoke. Whisk to combine and then set aside. ', 'Using a paper towel, remove the membrane from the back of all the ribs and then coat each side first with the wet rub and then with the dry rub. Once ribs are nicely coated, wrap them together in plastic wrap and place them in the fridge for 8-24 hours.', 'Remove the ribs from the fridge, and take off the plastic wrap. Place the ribs on a baking sheet and put in the freezer for 45 minutes.', 'Preheat oven to 500°F. ', 'Add the contents of 6 bags of lapsang tea to a baking sheet and the place a wire rack on top. Remove the ribs from the freezer and place on the wire rack. Cover the ribs and the baking sheet with aluminum foil. Tightly cover and make sure smoke can’t get out.', 'Cook for 30 minutes before removing the pan, lowering the heat to 250°F, and pouring a beer into the corner of the baking sheet. Place back in the oven for 1 ½ hours. ', 'During the last 30 minutes of cooking, make a simple barbecue sauce by heating some vegetable oil over medium heat and then adding all the ingredients of the barbeque sauce. Whisk to combine and then let sit on a low heat to stay warm.', 'Remove the ribs from the oven when they are done cooking, and coat one side with your homemade bbq sauce. Place under a broiler for 5-7 minutes or until brown and caramelized. Do the same to the other side of the ribs. ', 'Remove the bones from the ribs and now it’s time to plate up. Add the ribs to the bun and top with more barbecue sauce. Top with diced onion and pickles. Serve and enjoy!']",https://www.bingingwithbabish.com/
100084,Krabby Supreme inspired by Spongebob Squarepants,https://www.bingingwithbabish.com/recipes/krabbysupreme,https://images.squarespace-cdn.com/content/v1/590be7fd15d5dbc6bf3e22d0/1551211653322-U1ILCS2AVZTSUCITNAQD/ke17ZwdGBToddI8pDm48kGOFiGBTUYmUx_GqV0o9D8B7gQa3H78H3Y0txjaiv_0fDoOvxcdMmMKkDsyUqMSsMWxHk725yiiHCCLfrh8O1z5QPOohDIaIeljMHgDF5CVlOqpeNLcJ80NK65_fV7S1UTPxTW8fUX5HABHMO6OTcyox0ZzHYDHjRHah219tuZeGZtJ3qR9G2BYeA0wOAaeYNg/Screen+Shot+2019-02-26+at+2.05.11+PM.png?format=500w,2019-02-26,"[""Sometimes, you gotta give the people what they want. Play the hits. Let them eat...double-batter-fried-quad-burgers. This week I'm sacrificing both my health *and* dignity to bring you a very accurate recreation of one of Spongebob's greatest hits.  Do not try this at home.""]","['INGREDIENTS', 'Special Sauce', '⅓ cup mayo', '⅓ cup ketchup', '1 pickle, finely chopped', '1 tsp paprika', '1 tsp garlic powder', '¼ small onion, finely minced', '1-2 Tbsp yellow mustard', 'Krabby Patty', '1 lb. ground beef', 'Salt', 'Pepper', 'Vegetable oil', 'American cheese', 'Lettuce', 'Tomato', 'Pickle', 'Onion', 'Special sauce', '½ cup corn starch', '½ cup all purpose flour', '1 tsp baking powder', '1 tsp kosher salt', '¾ cup lager beer', '¼ cup vodka', 'Bacon', '2 quarts peanut oil']","['Method', 'Special Sauce', 'Combine all ingredients in a bowl and mix to combine. Season with salt and pepper if needed.', 'Krabby Patty', 'Roll your ground beef into 2 ounce spheres. Season with salt and pepper.', 'Add some vegetable oil to a cast iron skillet over high heat. Place two ground beef balls on the skillet. Use a cold metal spatula to press down on the meat, using a rolling pin (or something heavy) for leverage assistance.', 'Cook until one side is nice and brown, then flip and cook for about 30 seconds before adding cheese. Stack patties on top of each other and then set aside. You will need a total of 2 double patties.', 'Now build your burger. Bun on bottom followed by burgers and then top that with lettuce, tomato, pickles, onions, and special sauce. Repeat this again so you have a total of 4 burger patties and 3 buns. Place wooden skewers through the burger so it doesn’t fall apart.', 'In a bowl combine cornstarch along with all purpose flour, baking powder, kosher salt, lager, and vodka. Whisk to combine. Coat the burger in batter.', 'In a large pot, heat 2 quarts of peanut oil over medium high heat to 375°F.', 'Place your battered burger in the peanut oil and fry for about 4-6 minutes. Remove and place on a wire rack to drip excess oil and to cool off. Remove wooden skewers.', 'Dip burger in batter again and fry for another 4-6 minutes until evenly golden brown.', 'Remove from the oil and place on a wire rack to cool and drip any excess oil.', 'Add a stick, serve and enjoy!']",https://www.bingingwithbabish.com/
100085,Bao inspired by Pixar's Bao,https://www.bingingwithbabish.com/recipes/baobuns,https://images.squarespace-cdn.com/content/v1/590be7fd15d5dbc6bf3e22d0/1550609877277-329N2TQ4BQH27FGGUYKH/ke17ZwdGBToddI8pDm48kAjWERQgie3kB8ejE6nf73p7gQa3H78H3Y0txjaiv_0fDoOvxcdMmMKkDsyUqMSsMWxHk725yiiHCCLfrh8O1z5QPOohDIaIeljMHgDF5CVlOqpeNLcJ80NK65_fV7S1UQEqeeLdKFMcJ5Ju_8Nhx2VSS6OqZIl7gY_vrMBDodpyOpYghpI-Ha_TwZsqqmJXng/Screen+Shot+2019-02-19+at+2.50.36+PM.png?format=500w,2019-02-19,"[""Bao is a beautifully animated, thematically mature, subtle and nuanced portrait of the human condition - in other words, it's a Pixar production.  To celebrate the Oscars this coming weekend, let's dive into the director's mom's own recipe, as we attempt to recreate a food so delicious, you'll want to raise it as your own until it tries to leave you and you eat it.""]","['INGREDIENTS', 'Domee Shi’s Mother’s Bao Buns', 'Dough', '4 cups flour', '¾ tsp dry yeast', '500 ml water', 'Filling', '1 pound ground pork', '1 pound Chinese cabbage, minced', '1 carrot, minced', '2-3 green onion stalks, chopped', '1 egg', '1-2 tsp ground ginger', '1 tsp olive oil', '½ tsp chicken bouillon powder', '1 tsp oyster sauce', '2-3 tsp cooking wine', 'Salt', 'Pepper', 'Char Siu Bao Buns', 'Dough', '300g all purpose flour', '40g white sugar', '2 tsp yeast', '185ml whole milk', '1 Tbsp vegetable oil', 'Filling', '2 Tbsp white sugar', '2 Tbsp hoisin sauce', '1 Tbsp fermented red bean paste', '1 Tbsp soy sauce', '1 Tbsp Chinese cooking wine', '4 cloves of garlic, crushed', 'Ginger', 'Pork Belly', 'Char Siu Sauce', '2 Tbsp oyster sauce', '2 Tbsp hoisin sauce', '1 Tbsp honey', '1 tsp Chinese five spice powder', '1 Tbsp soy sauce', '1 Tbsp Chinese cooking wine', '1 Tbsp fermented red bean paste']","['Method', 'Domee Shi’s Mother’s Bao Buns', 'Mix the flour with the yeast in a mixing bowl.', 'Add water and knead until a solid dough ball forms. If it gets too sticky add more flour. If it’s too dry, add more water.', 'Cover and set aside for about 2 hours.', 'In a pan cook half of the ground pork over medium high heat until pork is golden brown. Add to a bowl with the rest of the uncooked pork.', 'In that bowl also add the cabbage, carrots, green onions, ground ginger, sesame oil, olive oil, bouillon powder, oyster sauce, cooking wine, 1 beaten egg and salt and pepper to taste. Mix to combine.', 'Once your dough has risen, dust your countertop with flour and roll out the dough into a long rope using the windmill technique.', 'Cut the dough into half-inch pieces and roll out to form wrappers. ', 'Add ½ Tbsp of filling into the center of the wrapper. Carefully pinch and fold the wrapper closed, twisting the top to finish. Make sure to press the dough tight to seal the top.', 'Bring a pot of water to a boil. Place the baos in a steam basket lined with cabbage leaves (or parchment paper coated with some oil) and place the basket on top of the boiling pot of water. Close the lid and let steam for 15 minutes, then turn off the heat and let the baos rest for 5 minutes.', 'Serve and enjoy!', '', 'Char Siu Bao Buns', 'Place In a bowl combine white sugar, hoisin sauce, fermented red bean paste, soy sauce, Chinese cooking wine, crushed garlic, and ginger. Mix to combine.', 'In a bag add your pork belly along with your sauce mixture. Close the bag and mix everything together. Place on a plate and let sit in the fridge for 24 hours. ', 'In a mixing bowl combine all purpose flour along with the white sugar, yeast, whole milk, and vegetable oil. Mix to combine until dough forms. Remove dough from the mixing bowl and then coat mixing bowl with oil and place the dough back in. Cover and let rest for 2 hours.', 'In a small bowl combine oyster sauce, hoisin sauce, honey, Chinese five spice powder, soy sauce, Chinese cooking wine, and fermented red bean paste. Whisk to combine, and then divide in half.', 'Line a rimmed baking sheet with foil and then add a wire rack on top and lightly coat with oil. Place pork on the wire rack and brush the top with some of your divided sauce.', 'Place pork in a 450° F oven for about 10 minutes. Remove, flip the pork, and brush down again with sauce. Repeat until internal temperature reaches 180°F and the outside is nicely caramelized and charred. ', 'Let cook for 5 minutes and then chop the pork belly into small pieces and then combine with the rest of the divided sauce. Mix to combine.', 'Once your dough has risen, dust your countertop with flour and roll out the dough into a long rope using the windmill technique.', 'Cut the dough into half-inch pieces and roll out to form wrappers. ', 'Add ½ Tbsp of filling into the center of the wrapper. Carefully pinch and fold the wrapper closed, twisting the top to finish. Make sure to press the dough tight to seal the top.', 'Bring a pot of water to a boil. Place the baos in a steam basket lined with cabbage leaves (or parchment paper coated with some oil) and place the basket on top of the boiling pot of water. Close the lid and let steam for 15 minutes, then turn off the heat and let the baos rest for 5 minutes.', 'Serve and enjoy!']",https://www.bingingwithbabish.com/
