b_with_b_id,recipe_name,recipe_link,recipe_thumbnail,date_published,recipe_description,recipe_ingredients,recipe_directions,external_url
100000,Omelette du Fromage inspired by Dexter's Laboratory,https://www.bingingwithbabish.com/recipes/omelette-du-fromage-dexters-laboratory,https://images.squarespace-cdn.com/content/v1/590be7fd15d5dbc6bf3e22d0/1605634757153-KD7JFZLJOUKBYY3Z16NT/ke17ZwdGBToddI8pDm48kELMIT6P-mXOKLp1AsW0HQB7gQa3H78H3Y0txjaiv_0fDoOvxcdMmMKkDsyUqMSsMWxHk725yiiHCCLfrh8O1z4YTzHvnKhyp6Da-NYroOW3ZGjoBKy3azqku80C789l0swtrMQrSykJ5045sc_U3bB2t9idZTyZfkWem5om76OgN0a1rqfTvLEpNmOmHby1BA/Screen+Shot+2020-11-17+at+11.32.35+AM.png?format=500w,2020-11-17,"['Today, I\'m given an excuse to (probably horrendously incorrectly) attempt some French - both the language and cuisine. An iconically challenging but ironically simple dish becomes the sole phrase in Dexter McPherson\'s normally-stacked vocabulary, the admittedly-seductive-sounding ""omelette du fromage"". Let\'s crack some eggs!']","['INGREDIENTS', 'American Omelette Ingredients:', '4 eggs', 'Kosher salt', 'Whole milk', '2 Tbsp unsalted butter', '3 slices Kraft American singles', 'Freshly ground black pepper', 'Omelette aux Fromage Ingredients:', '4 eggs ', 'Kosher salt', 'Gruyere cheese, shredded', '1 Tbsp unsalted butter', 'Butter, for finishing', 'Flaky Salt', 'Freshly ground black pepper', 'Chives, chopped']","['Method', 'American Omelette Method:', 'Start by cracking 4 eggs into a large bowl. Remove any shell remains from the bowl. Season with a pinch of salt and a splash of whole milk. Beat together.', ' In a large nonstick skillet, melt 2 tablespoons of unsalted butter. Once melted and foamy, dump in the eggs and move the eggs around a bit using a fork (nonmetal). ', 'Place 3 slices of American singles on one side of the omelette. Once the curds begin to solidify, fold the other half onto the cheese. ', 'Let cook a little longer until a little brown on the outside. Place on a plate and season with kosher salt and freshly ground black pepper. ', 'Omelette au Fromage Method:', 'Start by cracking 4 eggs into a large bowl with a pinch of kosher salt and beat vigorously. Strain into a separate bowl through a fine-mesh sieve. ', 'In a small bowl, shred a small batch of gruyere cheese. ', 'On the stovetop, preheat a carbon steel pan over medium heat. After 60-90 seconds, add 1 tablespoon of unsalted butter.', 'Once the butter is foamy and melted, add in the eggs and make sure to keep it moving by shaking the pan and stirring the eggs vigorously over medium heat. Quit stirring the moment the eggs are no longer liquidy. ', 'Drop the heat down to low. Tilt the pan away from oneself and shake it pushing the majority of the omelette to that side. ', 'Using a rubber spatula, begin rolling the omelette starting from the near end and stopping once reached halfway. ', 'Run the spatula underneath the omelette to make sure it is loose, keep the pan tilted down, and tap it propping the other end up. ', 'Fill the propped up end with the gruyere cheese and carefully fold the far end down over the roll. Work quickly to prevent any browning. ', 'Once the omelette is rolled up, quickly remove it from the pan to a plate and smear it down with butter. ', 'Season lightly with flaky finishing salt, a twist of freshly ground black pepper, and some fresh chopped chives. ']",https://www.bingingwithbabish.com/
100001,The Liz Lemon inspired by 30 Rock,https://www.bingingwithbabish.com/recipes/the-liz-lemon-30-rock,https://images.squarespace-cdn.com/content/v1/590be7fd15d5dbc6bf3e22d0/1605041745157-4N9J2WF2K8KM3FIB2L4G/ke17ZwdGBToddI8pDm48kO3agmuenxEiKUqx4vWgN1B7gQa3H78H3Y0txjaiv_0fDoOvxcdMmMKkDsyUqMSsMWxHk725yiiHCCLfrh8O1z4YTzHvnKhyp6Da-NYroOW3ZGjoBKy3azqku80C789l0hRRGx9f1qhpb7Lps8PMfI29W4_h8z707o9_axhAqPbvgWVe5fK92bDsx2FbFUNapw/Screen+Shot+2020-11-10+at+2.53.20+PM.png?format=500w,2020-11-11,"['This week, we conclude our (unintentional) sandwich trilogy with Liz Lemon’s innovative take on a classic Reuben, particularly her inspired inclusion of potato chips as a condiment. Grab your night cheese and get ready for a visit from MeatCat - can’t think of any other 30 Rock references? That’s a dealbreaker.']","['INGREDIENTS', 'Homemade Potato Chips Ingredients:', '3 large russet potatoes, sliced', '2 qts water', '2 tbsp white vinegar', 'Kosher salt', 'Homemade Bread Ingredients:', '360 g all-purpose flour', '185 g rye flour', '45 g potato flour', '28 g dried milk', '1 ½  tsp onion powder', '1 tbsp caraway seeds', '2 ¼ tsp kosher salt', '2 tbsp sugar', '2 tsp instant yeast', '400 g water, room temperature', '35 g vegetable oil', '1 tbsp rye flour (separate)', '1 tbsp cocoa powder', '1 egg', '1 tbsp water', 'Russian Dressing Ingredients:', '2 tbsp onion, finely chopped', '1 cup mayonnaise ', '¼ cup chili sauce', '2 tsp horseradish', 'Dash Worcestershire sauce', 'Hot sauce', 'Pinch Kosher salt', 'Shake paprika', 'Homemade Coleslaw Ingredients:', '2 cups green cabbage, finely chopped', '½ cup red cabbage, finely chopped', '1 carrot, peeled and finely shredded', '1 small dill pickle, finely chopped', '⅓ cup mayonnaise', '⅓ cup sour cream', '1 tbsp pickle juice', '1-2 tsp white wine vinegar', 'Shake of horseradish', '1 tbsp of sugar', 'Shake celery salt', '2 tsp freshly ground black pepper ', 'Kosher salt ', 'Assembly Ingredients:', 'Bread', 'Swiss cheese', 'Russian dressing', 'Coleslaw', 'Pastrami', 'Turkey', 'Potato Chips']","['Method', 'Homemade Potato Chips Method:', 'Start by shaving 3 large russet potatoes into thin slices using a mandoline on its thinnest setting directly into a cool water bath.', 'While the potatoes rinse under cool running water, bring 2 quarts of water to a boil spike with 2 tablespoons of white vinegar. ', 'Place the potatoes into the pot and par-cook them for 3 minutes. ', 'Spread the potatoes out onto paper towels to let cool. Let dry for 10 minutes. ', 'After drying, place into a 325°F vegetable oil frying for 5-8 minutes during which time each slice needs to be flipped constantly. ', 'Fry until just shy of done before placing the potatoes onto a paper towel-lined rimmed baking sheet and sprinkling immediately with kosher salt. Rinse and repeat with the remaining potato slices. ', 'Homemade Bread Ingredients:', 'Into the bowl of a stand mixer goes 360 grams of all-purpose flour, 185 grams of rye flour, 45 grams of potato flour, 28 grams of dried milk, 1 ½  teaspoon of onion powder, 1 tablespoon of caraway seeds, 2 ¼ teaspoons of kosher salt, 2 tablespoons of sugar, and 2 teaspoons of instant yeast. Whisk together.', 'Once fully incorporated, add in 400 grams of room temperature water and 35 grams of vegetable oil. Fix a dough to the stand mixer and knead on medium-low speed for 5-8 minutes. Scrape down the hook as it kneads if the dough starts to climb it.', 'Turn out onto a lightly floured work surface and knead by hand for about 1 minute and form into a taut ball before dropping into a well-oiled bowl. Cover with plastic wrap and rise at room temperature for 90 minutes. ', 'Once doubled in size, turn out onto an un-floured work surface and divide in half. Wrap one of the halves in plastic wrap and set aside. ', 'Place the other half into the bowl of the stand mixer, mix it with 1 tablespoon each of rye flour and cocoa powder (mixed together separately in a small bowl). ', 'Knead for about 3 minutes on medium-low speed and scraping down the dough hook so everything is evenly mixed. ', 'On a generously floured work surface,  roll out the lighter dough into a rectangle long enough to fit into whatever loaf pan is being used. Once achieved, repeat with the cocoa dough. ', 'Lay the cocoa dough on top of the lighter dough and roll into a tight, air sealed, loaf. ', 'Place seam side down into a well-oiled loaf pan. Let proof under a loosely tinted sheet of oiled plastic wrap. Let rest for 90 minutes or until double in size. ', ' During the last 30 minutes of proofing, preheat the oven to 400°F. ', 'Brush down the loaf with 1 egg beaten together with 1 tablespoon of water and then score the loaf with 3 deep cuts. ', 'Loosely tent the pan with aluminum foil and place in the oven for 15 minutes at 400°F before dropping the temperature to 350°F and baking for an additional 20 minutes. Uncover and bake for a final 5 minutes. Internal temperature should be 195-205°F.', 'Extract from the loaf pan and let cool on a wire rack for 3 hours before slicing. ', 'Russian Dressing Method:', 'Into a large bowl goes 2 tablespoons of finely chopped onion, 1 cup of mayo, ¼ cup of chili sauce, 2 teaspoons of horseradish, a dash of Worcestershire sauce, desired hot sauce, a pinch of salt, and a little shake of paprika. ', 'Mix until thoroughly combined. ', 'Homemade Coleslaw Method:', 'Into a large bowl goes 2 cups of finely chopped green cabbage, ½ cup of finely chopped red cabbage, 1 peeled and finely shredded carrot, 1 finely chopped small dill pickle (about 2 Tbsp worth), ⅓ cup each of mayonnaise and sour cream, 1 tablespoon of pickle juice, 1-2 teaspoons of white wine vinegar, shake of horseradish, 1 tablespoon of sugar, shake of celery salt, and a few teaspoons of freshly ground black pepper. Season to taste with kosher salt. ', 'Mix until thoroughly combined. ', 'Assembly Method:', 'Lightly spread mayonnaise on one side of each slice and toasting in a frying pan. ', 'Stack high with slices of pastrami on the bottom slice, 2 slices of swiss on the top slice, coleslaw in the middle (on top of the pastrami), slices of turkey, a generous dollop of Russian dressing on the swiss cheese, and topping it all off with the homemade potatoes chips (better enjoyed in the middle of the sandwich). ', 'Slice and enjoy.']",https://www.bingingwithbabish.com/
100002,Brie & Butter Baguette inspired by Twin Peaks,https://www.bingingwithbabish.com/recipes/brie-butter-baguette-twin-peaks,https://images.squarespace-cdn.com/content/v1/590be7fd15d5dbc6bf3e22d0/1604423930484-BITH5DLR2XKI4JB03I8G/ke17ZwdGBToddI8pDm48kIt4sjjsJou2GjInMlJIhlR7gQa3H78H3Y0txjaiv_0fDoOvxcdMmMKkDsyUqMSsMWxHk725yiiHCCLfrh8O1z4YTzHvnKhyp6Da-NYroOW3ZGjoBKy3azqku80C789l0vxgGVdDnL6CCr5FK_ApnxWVFFcmHtSzhfSGu0LxuW6Rsr_7xnuZTWl8VctZwoBSoQ/Screen+Shot+2020-11-03+at+11.15.22+AM.png?format=500w,2020-11-03,"[""This week we're headed back to Twin Peaks WA, but for once, not with murder on the mind. Instead, we're focusing on the food: brie and baguette sandwiches, fresh from Paris, furnished by an unhealthy relationship with a younger sibling. Brie and butter on a baguette isn't just a delicious-sounding alliteration - it's a classic French sandwich that actually lives up to the hype. Sometimes a few simple ingredients can come together to create something greater than the sum of their parts, and there are few finer examples than this comforting, indulgent mixture of fat and carbs.""]","['INGREDIENTS', 'Overnight Poolish Ingredients:', '120 g bread flour', 'Instant yeast', '½ cup cool water', 'Baguette Ingredients:', '420 g bread flour', '4.5 g instant yeast', '12 g kosher salt', '270 g warm water', 'Overnight poolish', 'Brie', 'High quality French butter']","['Method', 'Baguette Method: ', 'Start by making an overnight poolish by mixing together 120 grams of bread flour, a pinch of instant yeast, and ½ cup (118 g) of cool water. Whisk until no dry lumps remain. Cover and let sit at room temperature for at least 12 hours or up to 18 hours.', 'In a large bowl, mix and combine 420 grams of bread flour, 4 ½ grams (1.5 tsp) of instant yeast. After quickly whisking together, add in 12 grams (2 tsp) of kosher salt, 270 grams of warm water, and the starter from earlier (overnight poolish). Mix together using a rubber spatula.', 'Once combined begin kneading by hand until a shaggy dough forms and dump onto an un-floured work surface and continue to knead via the slap and fold method. Repeat for 8-15 minutes or until the dough passes the windowpane test. ', 'Place the dough into a large bowl, cover with plastic wrap, and let rest for 1 ½ hour. Halfway through the ferment, lift the dough from the edge and fold it into the center. Repeat this 5-6x making sure to rotate the bowl each time. ', 'After an additional 45 minutes, place the dough out onto a lightly oiled work surface and divide it into halves before patting out into a rectangle. Fold in the side closest to oneself and repeat with the other side, then press down vigorously to seal. ', 'Repeat the process of folding down each side into the center, making sure to pat down to seal before rolling out from the center of the dough.', 'To bake via a baguette loaf pan, place the dough into the loaf pan then inside a proofing bag and then inflate the bag and let rise for 45 minutes. ', 'To bake via couche, place the dough in a large linen cloth that’s been heavily floured and folded into trenches. Let the dough sit and rise under a damp towel for 45 minutes. ', 'Once each method is done proofing, score 5 long diagonal slots on each piece using a razor blade or knife. ', 'If baking on a pizza stone, bake at 450°F for anywhere between 17-20 minutes.  ', 'For baking on a baguette pan, bake at 450°F until an internal temperature of 195-205°F and a deep brown crust. ', 'Slice lengthwise into halves and spread high-quality french butter on both sides with a pinch of kosher salt (if butter is unsalted), and a generous stack of sliced brie before topping off with the other slice and enjoy.  ']",https://www.bingingwithbabish.com/
100003,The Broodwich inspired by Aqua Teen Hunger Force,https://www.bingingwithbabish.com/recipes/broodwich-aqua-teen-hunger-force,https://images.squarespace-cdn.com/content/v1/590be7fd15d5dbc6bf3e22d0/1603821354341-TGCK3OOI1PTNPOKPC69R/ke17ZwdGBToddI8pDm48kOxLRGAfd8DHyn-VO-OS79h7gQa3H78H3Y0txjaiv_0fDoOvxcdMmMKkDsyUqMSsMWxHk725yiiHCCLfrh8O1z4YTzHvnKhyp6Da-NYroOW3ZGjoBKy3azqku80C789l0usXCOu1ni7cqT7DpdWG1QXsxC4JUKCTfgXShWWMRL-jMKpWpWZXzvRmlf_9uuK6qg/Screen+Shot+2020-10-27+at+12.48.57+PM.png?format=500w,2020-10-27,"[""This week, to celebrate Halloween, I bend my no-fantasy-food-rule in favor of that most unholy of sandwiches, the Broodwich. It wasn't forged in darkness, it wasn't baked by Beelzebub - but it does have a sinful amount of meat, hand-beaten mayo, lots of sun dried tomatoes, and lettuce. BED OF EVIL AND LETTUCE!""]","['INGREDIENTS', 'Red Sandwich Bread Ingredients: ', '510 g bread flour', '10 g instant yeast', '30 g sugar', '1 cup whole milk', '1 egg', '3 Tbsp oil', '2 tsp salt', 'Red coloring, 3 big squirts', 'Honey Baked Ham Ingredients:', '3 lb boneless pork shoulder', '10 g pink curing salt', '50 g kosher salt', '1 cup brown sugar', '1 Tbsp honey', '1 gallon distilled water', 'Pastrami Ingredients: ', 'Brisket', '2 Tbsp pickling spices', '2 tsp pink curing salt', '1 cup brown sugar', '100 g kosher salt', '2 gallons distilled water', '3 Tbsp coriander seeds, crushed', '3 Tbsp freshly ground black pepper', '1 tsp mustard powder', '1 tsp paprika', '1 tsp garlic powder', '1 tsp onion powder', 'Mortadella Ingredients: ', '2lbs pork belly', '3lbs lean pork', '1 tsp star anise', '1 tsp caraway seeds. ', '1 tsp garlic powder', '1 tsp mace', '1 tsp white pepper', '1 tsp pink curing salt', '1 tsp ground coriander', '3 tsp kosher salt', '¾ cup shelled unsalted roasted pistachios', '2 Tbsp black peppercorns. ', 'Boiling water', 'Peppered Turkey Ingredients:', 'Turkey breast', 'Kosher salt', 'Freshly ground black pepper', 'Roast Beef Ingredients:', 'Large eye round roast', 'Kosher salt', 'Freshly ground black pepper', 'Homemade Mayo Ingredients:', '2 whole eggs', '1 tsp dijon mustard', '2 Tbsp lemon juice ', '1 garlic clove, crushed', 'Pinch kosher salt', '2 cups neutral flavored oil (like vegetable oil)']","['Method', 'Honey Baked Ham Method:', 'For the cure for a 3 lb piece of pork, combine 10 grams of pink curing salt, 50 grams kosher salt, 1 cup brown sugar, 1 tablespoon of honey, and 1 gallon of distilled water. Whisk together. ', 'Place the 3lb pork shoulder into the liquid and let cure in the solution for 3-5 days. Move around once per day to agitate the pork.', 'When ready to cook, pat the pork dry on a wire rack set in aluminum lined rimmed baking sheet and insert temperature probe, and roast 300°F for anywhere between 2-3 hours. Slice and enjoy.', ' Pastrami Method:', 'Start by dividing a large chunk of brisket into its lean and fatty portions. ', 'For the cure, add and combine 2 tablespoons of pickling spices, 2 teaspoons of pink curing salt, 1 cup of brown sugar, 100 grams of kosher salt, and 2 gallons of distilled water. Whisk until dissolved. ', 'Place the brisket pieces into the cure and fridge for 3-5 days. Remove and agitate once every 24 hours. ', 'When finished curing, place the brisket in cool water for 1 hour before cooking. ', 'Transfer the brisket into a large pot, covered with water, and bring to a simmer for 2-3 hours. ', 'For the spice mix, combine and whisk together 3 tablespoons of crushed coriander seeds, 3 tablespoons of freshly ground black pepper, and 1 teaspoon each of mustard powder, paprika, garlic powder, and onion powder. Distribute evenly on the corned beef into every inch. ', 'Place in a smoker for 2 hours at 225°F. Slice and enjoy.', 'Mortadella Method:', 'Start by removing the skin from 2lbs pork belly and cutting into ½” chunks. Set into two evenly sized groups of most fatty and least fatty. ', 'Least fatty pieces are placed out evenly on a parchment-lined baking sheet and freeze for 15-20 minutes.', 'The fatty pieces are reserved in a bowl and placed in the fridge until ready to use. ', 'With an additional 3lbs of lean pork (whole loin roast) cut into 1” pieces. Spread out evenly on a parchment-lined baking sheet and freeze for 20 minutes. ', 'Using a meat grinder, grind the frozen pork loin and pork belly on the largest setting into a large bowl. ', 'For the spice mix, in a spice grinder mix together 1 teaspoon each of star anise and caraway seeds. Run through a fine-mesh sieve into a small bowl and combine with 1 teaspoon each of garlic powder, mace, white pepper, pink curing salt, ground coriander, and 3 teaspoons of kosher salt. Whisk to combine.', 'Add the spices to the coarsely ground pork and toss together by hand until evenly distributed. ', 'Run the now spiced pork back through the grinder on the finest setting into a large bowl. ', 'Spread the ground pork evenly over parchment-lined baking sheets and freeze for 20 minutes. ', 'For the fatty pork pieces, place into a large bowl along with ¾ cup of shelled unsalted roasted pistachios, and 2 tablespoons of black peppercorns. Cover the whole with boiling water and let sit for 20 minutes. Strain and set aside.', 'Using a chilled food processor grade, add in the semi-frozen ground pork and emulsify with some frozen red wine and ice water (2 tablespoons each per pound of pork). Process in batches for about 45 seconds until emulsified. ', 'Place into a large mixing bowl, massage together before adding in the cooled fat, nut, and peppercorn mixture and mixing until evenly distributed. ', 'On a few layers of plastic wrap, dump the pork out and pat it out into a large log pressing in any big chunks. Wrap tight in plastic wrap, twisting rotating up each end tightly until the plastic wrap is taut. Place in fridge for 24 hours. ', 'After 24 hours, vacuum seal and sous vide at 158°F for 5-6 hours. Afterward, transfer into an ice bath and let it cool completely in the fridge. Slice and enjoy.', 'Peppered Turkey Method:', 'On a wire rack set on an aluminum lined baking sheet, coat a turkey breast generously with kosher salt and freshly ground black pepper. ', 'Place in the fridge overnight before roasting 300°F for 45 minutes or reach an internal temperature of 145°F. It will eventually rise to 150°F. Slice and enjoy.', 'Roast Beef Method:', 'On a wire rack set on an aluminum lined baking sheet, coat a large eye round roast with a bunch of kosher salt and freshly ground black pepper. ', 'Place in the fridge overnight before roasting 300°F until an internal temperature of 120°F.', 'Wrap in plastic wrap, place in the refrigerator until ready to slice. ', 'Red Sandwich Bread Method:', 'Combine all ingredients except for red food coloring in a mixing bowl with a dough hook attachment. ', 'While the dough is mixing, add food coloring until dough reaches a medium red color.', 'Continue kneading until the dough no longer sticks to the sides and is smooth in texture (not ripping immediately), about 7-10 minutes.', 'Allow resting, covered, at room temperature for 1 hour. ', 'Cut 1 small portion of dough off while rolling the rest into a 16”x12” rectangle. Begin rolling from the bottom to the top lengthwise. Form and twist into a submarine roll. ', 'For the smaller portion of dough, roll into small logs that resemble horns and a tail. ', 'Allow resting on a parchment-lined baking sheet, covered, at room temperature for 45 minutes. ', 'Score as desired. ', ""Bake at 350 (no convention) for about 18 minutes, or until the bread's internal temperature reaches 200-210°F."", 'Let cool completely on a wire rack. ', 'Mayo Method:', 'In a container, combine 2 whole eggs, 1 teaspoon of dijon mustard, 2 tablespoons of lemon juice, 1 crushed garlic clove, and a pinch of kosher salt. ', 'Blend lightly until just combined and then top with 2 cups of a neutral flavored oil (vegetable oil). ', 'Place the immersion blender head at the bottom of the cup and begin blending from the bottom up. ', 'Broodwich Assembly: ', 'Slice the bread in half and generously lather the bottom slice with the homemade mayonnaise along with dijon mustard. ', 'Pile high using the various slices of homemade cold cuts before topping with slices of provolone and cheddar cheese along with lettuce and copious amounts of sundried tomatoes. ', 'Generously lather the top slice of bread with mayonnaise and dijon mustard before decorating with the horns and tail.  ']",https://www.bingingwithbabish.com/
100004,Mississippi Queen inspired by Regular Show,https://www.bingingwithbabish.com/recipes/regular-show-mississippi-queen,https://images.squarespace-cdn.com/content/v1/590be7fd15d5dbc6bf3e22d0/1603224442896-QRWRE8UVLH9X4KOHVY2R/ke17ZwdGBToddI8pDm48kOxLRGAfd8DHyn-VO-OS79h7gQa3H78H3Y0txjaiv_0fDoOvxcdMmMKkDsyUqMSsMWxHk725yiiHCCLfrh8O1z4YTzHvnKhyp6Da-NYroOW3ZGjoBKy3azqku80C789l0usXCOu1ni7cqT7DpdWG1QXsxC4JUKCTfgXShWWMRL-jMKpWpWZXzvRmlf_9uuK6qg/Screen+Shot+2020-10-20+at+2.59.15+PM.png?format=500w,2020-10-20,"[""This week we're celebrating 8 million subscribers with a tour of the office, a surprise kitten, and what's becoming a tradition for subscriber milestones: another death-defying food challenge from Regular Show. The Mississippi Queen is prepared, in detail, so we can recreate it with some accuracy - but steps must be taken to transform it into a hallucinogenic kids' show mindf*ck! Thank you so much for helping me reach the big 8!!""]","['INGREDIENTS', 'Bloody Mary Ingredients:', '32 oz tomato juice', 'Chili sauce', 'Rice vinegar', 'Clam juice', 'Soy Sauce', 'Fish Sauce', 'Kimchi', '¼ cup horseradish, peeled and grated', 'Wasabi', '1 habanero pepper, seeded and chopped.', 'Celery salt', 'Porcini mushrooms, dried and grinded', 'Shrimp, peeled and deveined', 'Scallops', 'Mayonnaise', 'Aleppo pepper', 'Chocolate, grated', 'Butter']","['Method', 'Mississippi Queen Mix Method:', 'Into a blender add 32 ounces of tomato juice, splash each of chili sauce, rice vinegar, clam juice, soy sauce, and fish sauce along with a few pieces of kimchi. ', 'Peel and grate a ¼ cup of horseradish into the blender along with a little wasabi. ', 'Add in one seeded and chopped habanero pepper. Make sure to wear gloves. ', 'Add in a little shake of celery salt, kosher salt, and freshly ground black pepper. Blitz in the blender until relatively smooth. ', 'In a spice grinder, grind a few pieces of porcini mushrooms into a fine powder (do not breathe the powder dust) and pass it through a fine-mesh sieve to catch any thick chunks. Pour into the blender and blend into the bloody mary mixture. ', 'Shrimp & Scallop Method:', 'Start by peeling and devein the shrimp by making a shallow cut down the back of the shrimp and removing the digestive tract. ', 'For the scallops, simply sear in a high smoke point oil like grapeseed oil. Sear over medium heat for a solid minute and a half before flipping onto the other side. Butter based, like a steak, for 3 minutes or until the thickest point registers at 130°F. Place on a paper towel to cool.', 'For the shrimp, saute each piece very quickly on each side and flip occasionally so the shrimp doesn’t burn. Cook until internal temperature reaches 130°F.', 'Assembly Method: ', 'In separate small bowls, dump in mayonnaise and combine Aleppo pepper with freshly grated chocolate, whisk together. Take the desired drinking glass and dip into the mayonnaise and then into the Aleppo pepper and chocolate mixture. ', 'To the glass, add in a few pieces of ice along with a shot of vodka and pour the bloody mary mix over top. Stir to combine.', 'Garnish with a stalk of celery and skewered shrimp and scallops (2 of each) before enjoying with a metal straw. ']",https://www.bingingwithbabish.com/
